amaxen	vote for free silver and be prosperous like us republican party antifree silver poster	1479723584.0	i.redd.it	True	5e3d9x	https://preview.redd.it/sbhbja8a8yyx.jpg?width=320&crop=smart&auto=webp&s=4d41e868166c1c29dc08325c7f103e6e2bec0223		14.0	125	propagandaposters	'Vote for Free Silver and be Prosperous like....', 1896, US, Republican Party anti-Free Silver Poster	0.98	0	1	5
michaelconfoy	a federal art project silkscreen poster from syphilis cause heart trouble blindness deafness mental disorders have your blood tested	1419096408.0	i.imgur.com	True	2pwczk	https://external-preview.redd.it/bzkXhLQRGllJiFFMBfYwvfqIgo9Ku5j91i88938ghKg.jpg?width=320&crop=smart&auto=webp&s=8be3d3ad2a297286e56d7515cebb79d37424ee15		3.0	16	propagandaposters	"A Federal Art Project silkscreen poster from 1941 ""SYPHILIS MAY CAUSE heart trouble blindness deafness mental disorders HAVE YOUR BLOOD TESTED"""	0.83	0	1	5
theplanegeek	resolutely cut off the bloody and criminal hand of the american aggressor that spreads germs chinese vaccination program	1364698740.0	chineseposters.net	True	1bc7p8	https://external-preview.redd.it/6RH8AF3izRbJgqHdU6LmvxhDr3B2KNBNaOK1XVXMPZA.jpg?width=320&crop=smart&auto=webp&s=dddbfaab58a3fccde9ac29b1d009440bedac2afb		4.0	71	propagandaposters	Resolutely cut off the bloody and criminal hand of the American aggressor that spreads germs!- Chinese vaccination program	0.95	0	1	5
commieflirt	communism is the answer american anticommunist comic s	1468413766.0	i.imgur.com	True	4smy88	https://external-preview.redd.it/FzGI0CtWIkflYxVjOHlF9WmvKBHxHrRDGgfDFwntc0w.jpg?width=320&crop=smart&auto=webp&s=ebcb117ff11f1d35b92dfc0818c7e0df19687b99		51.0	152	propagandaposters	"""Communism is the answer,"" American anti-communist comic (1950-60s?)"	0.95	0	1	5
theluxemburgist	no chatter ussr wwii	1479464595.0	i.redd.it	True	5dlq89	https://preview.redd.it/5imi3mgetcyx.jpg?width=320&crop=smart&auto=webp&s=520d8da0eddc63f563c5787f79514b700f6ef5d9		4.0	39	propagandaposters	"""No Chatter"", USSR, 1941 WWII"	0.94	0	1	5
Gregordinary	leaflets used in iraq and afghanistan by us army psyops	1363649627.0	imgur.com	True	1ak2ur	https://external-preview.redd.it/Dz2_mKPcvXaV9EW8KWi1VGRGRIoC1Px7DD2Bl1zxm80.jpg?width=320&crop=smart&auto=webp&s=4ec08a2b86afd70b5fafba107f3d130483587f5f		23.0	151	propagandaposters	Leaflets used in Iraq and Afghanistan by US ARMY PsyOps.	0.95	0	1	5
Vladimir_Jr	sport posters of s modern communism health poster	1366001743.0	imgur.com	True	1cdeio	https://external-preview.redd.it/id6qSMcELr9YyVf5FB8Zyra6lsEpbblIF8jo_dwekSA.jpg?width=320&crop=smart&auto=webp&s=306b25209123686b4353542083ae8c4b49ddd3cc		3.0	18	propagandaposters	"""Sport posters of 1920-1960s"", Modern [communism, health, poster]"	0.92	0	1	5
saargrin	us army recruiting ad army strong campaign	1459771229.0	military.com	True	4daqz4	https://external-preview.redd.it/aNsiYSbnwzCqc4VN7kimyqNe33bJimfVNZR2Mc64Onw.jpg?width=320&crop=smart&auto=webp&s=ecd9235e9e0530ea30059e2c3dfc42f693c3c5b9		0.0	4	propagandaposters	"US Army recruiting ad, 2011 , ""Army Strong"" campaign"	0.7	0	1	5
TommBomBadil	bolshevism brings war unemployment and famine germany	1496538349.0	imgur.com	True	6f4pf0	https://external-preview.redd.it/BEzg7y7SthHAc35hVslSIxgVcaS3VLGkuu8lgH9oR44.jpg?width=320&crop=smart&auto=webp&s=7c9b359b5cc71eacbe8f9db1580ed88f811c83c6		3.0	66	propagandaposters	"""Bolshevism brings war, unemployment and famine"", Germany, 1918"	0.98	0	1	5
CharmzOC	all the free speech money can buy usa anticorruption	1471029848.0	i.redd.it	True	4xfbob	https://preview.redd.it/okfcm56650fx.jpg?width=320&crop=smart&auto=webp&s=8779adfb4059262530bb26a169efb2f5a13eba26		11.0	276	propagandaposters	"""All the Free Speech Money Can Buy"", USA Anti-Corruption, 2016"	0.98	0	1	5
sdfghs	dont touch german penises no to eu standard penis	1420391341.0	i.imgur.com	True	2rb8el	https://external-preview.redd.it/-MJ3knMYON05zSzEYynlruF1qBVNkv41Q6iWa3lTPaU.jpg?width=320&crop=smart&auto=webp&s=426eef53362026835289819610c867fc140ca7ab		9.0	135	propagandaposters	Don't touch German penises. No to Eu standard penis [2014]	0.96	0	1	5
5_Frog_Margin	antidrug poster vang vieng laos	1440282016.0	imgur.com	True	3i0loh	https://external-preview.redd.it/SwH4qCtMOhNfeD08S-6yKsxHtCSpY1JRIh6Vh_FsJng.jpg?width=320&crop=smart&auto=webp&s=e88c91f668c0b08d5c388c64f645da91310f9c68		3.0	33	propagandaposters	Anti-drug Poster (Vang Vieng, Laos 2012)	0.98	0	1	5
Thaddel	two valiant fighters postcard about the substitude foods following the british blockade germany	1486992445.0	i.imgur.com	True	5tsudu	https://external-preview.redd.it/qo58ExS5MBzuCc53E7kBjPZw8JVfuLWO2rmes5UMMY0.jpg?width=320&crop=smart&auto=webp&s=d43169eb6bfb5574e00584c0980e769524fd3d85		10.0	354	propagandaposters	"""Two Valiant Fighters"" - Postcard About the Substitude Foods Following the British Blockade - Germany, 1917"	0.96	0	1	5
descriptivetext	freedom calls for its bravest men uk recruitment poster in welsh	1464564332.0	i.imgur.com	True	4lmt1z	https://external-preview.redd.it/ummGXVeQInMFbHyutwVLPBRGWneDvNyJrSpdw2Y8chk.jpg?width=320&crop=smart&auto=webp&s=4daed9fcae8b1b5c2990219b7d201157ebb79c0c		0.0	39	propagandaposters	"""Freedom Calls for its Bravest Men"", UK recruitment poster, 1915 (in Welsh)"	0.95	0	1	5
Indifferent94	bolshevik freedom polish made during the polishsoviet war	1447226383.0	en.wikipedia.org	True	3sdrrs	https://external-preview.redd.it/j9n6bKVWOBwkMocCN6E2muqLL_mHqt5rXxxa3JD6KEU.jpg?width=216&crop=smart&auto=webp&s=32d9d46482b5cca220467411cf18991e13ccc614		8.0	38	propagandaposters	"""Bolshevik freedom"" [1920] Polish, Made during the Polish-Soviet war"	0.95	0	1	5
LeonardWoods	corsica italian land s	1472392479.0	i.reddituploads.com	True	4zzgjk	https://external-preview.redd.it/bzGoYSk84pZ6Zspy9xXCk6APDRzVsFRo2ipDU3XvwIU.jpg?width=320&crop=smart&auto=webp&s=6ed215b4c7bb85dcc1658091dc2c6a65a669047e		1.0	73	propagandaposters	"""Corsica Italian Land"" [1930's]"	0.95	0	1	5
FantsE	whos helped by raising the minimum wage	1459394754.0	i.imgur.com	True	4coazi	https://external-preview.redd.it/wWcRIzKw809Owq9thL6rANpkBLHypZG0UAIh-7EF_Z4.png?width=320&crop=smart&auto=webp&s=562fc70d66679b132b7e0a250521ec18409d36a9		214.0	851	propagandaposters	Who's Helped by Raising the Minimum Wage | USA, Modern	0.9	0	1	5
Geeglio	they will not prevail italy	1501761621.0	i.redd.it	True	6rbsse	https://preview.redd.it/4m5bahaiiidz.jpg?width=320&crop=smart&auto=webp&s=822583a3188a09d7b66dbe7cfcadc26eceb95356		100.0	1001	propagandaposters	"""They will not prevail"", Italy, 1944"	0.96	0	1	5
The_Turk2	megali idea inspired map from the concessions of the treaty of sevres	1469017987.0	upload.wikimedia.org	True	4tqwsn	https://external-preview.redd.it/ZdE_F-0kH8LzTBsQj4XeSU2xj1oVHakk52Rkzoqqmwg.jpg?width=320&crop=smart&auto=webp&s=78260eef3d6753916a567c9919eb7a05914782d4		15.0	157	propagandaposters	'Megali Idea' Inspired Map from the Concessions of the Treaty of Sevres (~1920)	0.96	0	1	5
SauerkrautandBeans	sure i want to fight communism but how	1413417422.0	imgur.com	True	2jdb3g	https://external-preview.redd.it/ml1OlWfmUEAnN2E9c_0dKhTt9Xp0WJzWM-G4vFHSovI.jpg?width=320&crop=smart&auto=webp&s=b36e0dc79823679c5bba7c01325aca681e84e32d		18.0	202	propagandaposters	Sure, I want to fight Communism - but how? [1955]	0.98	0	1	5
Argentina_es_blanca	a donald trump poster thats based on spanish civil war	1439449161.0	imgur.com	True	3gtmav	https://external-preview.redd.it/Gb2zUE15jCGq-mS1V6LsxLS32HYOYn0FdtAFk_rIOHk.jpg?width=320&crop=smart&auto=webp&s=df10069aefd8d00a83467344090a085871dd11dc		53.0	282	propagandaposters	A Donald Trump poster that's based on Spanish Civil War propaganda	0.94	0	1	5
MuslimWithFootFetish	american black panther poster	1468808576.0	i.imgur.com	True	4tcw7h	https://external-preview.redd.it/3o7bqhM7nrll3SfZyUaQVTl1-ewN1CsVuNiTUwNenbY.jpg?width=320&crop=smart&auto=webp&s=f75038cadccd2fc6f4ecb51c9c244c3547ad6d34		3.0	99	propagandaposters	American Black Panther poster [1970]	0.89	0	1	5
AnalogDan	modern poster telling law enforcement officials to stay in shape	1391718297.0	i.imgur.com	True	1x7iik	https://external-preview.redd.it/16qWeA0y55f3KvKKtabPCHvsbuxXlp0l451DOdDGKgo.jpg?width=320&crop=smart&auto=webp&s=d9d3488fd347951f426f53da1db80a1d4ff0161a		10.0	251	propagandaposters	Modern poster telling law enforcement officials to stay in shape.	0.96	0	1	5
rpilek	which fateor economy in life boats editorial cartoon in the new york herald on two days after the titanic sank origin of post in comments	1416505165.0	cdn.loc.gov	True	2mw6st	https://external-preview.redd.it/TAsg3NIT07ZtoPS6tzdmi6n9RFUpNp2895p15lTYIrA.jpg?width=320&crop=smart&auto=webp&s=2665a222687e4f7e1b5d933a3e4a3d0e50e0cc2f		1.0	88	propagandaposters	"""Which? fate--or economy in life boats?"" Editorial cartoon in the New York Herald on April 17, 1912, two days after the Titanic sank. (Origin of post in comments.)"	0.95	0	1	5
	north korea leaflet directed to un troops shows a bereaved mother saying give us my son not a medal includes small illegible text in the bottom right	1458260583.0	psywarrior.com	True	4avxvn	https://external-preview.redd.it/jhJ_JYRwyyuNsUjaLjElBUIPl-GEgYZUOjUnEHlPKns.jpg?width=320&crop=smart&auto=webp&s=463551edc8a66b2560dd99cc51b0665b12bfc6ab		0.0	15	propagandaposters	"1950 North Korea leaflet directed to U.N troops. Shows a bereaved mother saying ""give us my son, not a medal."" Includes small, illegible text in the bottom right"	0.82	0	1	5
sparatuvs	the story of motorola hero of novorossiya eng subs east ukrainerussia	1421937310.0	youtube.com	True	2tah41	https://external-preview.redd.it/Adbymxm2vtzLolrnsgkBIs9ipXTVsPOUb7nleLRrSrE.jpg?width=320&crop=smart&auto=webp&s=6f8547a03ae93164b8034e9f25a027309cfb2611		1.0	5	propagandaposters	The Story of Motorola, Hero of Novorossiya -Eng Subs [2014, East Ukraine/Russia]	0.62	0	1	5
booksworm	rd international womens congress for peace and freedom vienna austria	1504869225.0	i.imgur.com	True	6yu4gd	https://external-preview.redd.it/6oSH8nBqkM51RwUCdDZ49rJ4J1rjetFZjlcBaWjFomc.jpg?width=320&crop=smart&auto=webp&s=06862aed31c5dfaf8c91cf8deec87100476755d0		1.0	22	propagandaposters	3rd International Women's Congress for Peace and Freedom - Vienna, Austria (1921)	0.92	0	1	5
redditmortis	how i see the us presidential election as a nerd	1458362234.0	imgur.com	True	4b1tqc	https://external-preview.redd.it/owPMPFkexPvNYHFdYK4lIPNXOVRn45si3OxoL0tmWHY.jpg?width=320&crop=smart&auto=webp&s=c7f2597b7aa1b7ae7688b8ef7a636f259198e2cd		29.0	185	propagandaposters	"[2016] ""How I see the US Presidential Election as a Nerd."""	0.79	0	1	5
	call to armsirishmen do you hear it world war	1418765110.0	i.imgur.com	True	2pibk0	https://external-preview.redd.it/kHUn8tcdtt0cZiNruMBEYJ5jlqSgqntdea0qN3EGpCQ.jpg?width=320&crop=smart&auto=webp&s=867deec7401808c934e4bfafaed6aa87471b4931		8.0	133	propagandaposters	Call to arms!Irishmen do you hear it? (World War 2)	0.97	0	1	5
durandall08	press forward eve poster	1373306628.0	i.imgur.com	True	1hvlzk	https://external-preview.redd.it/mg8mrsHNGfOr3jWNtwLTV3CLjtZ7ytmQ1MRC988viGQ.jpg?width=320&crop=smart&auto=webp&s=c5892e99672624f53a84113a429def8cfbb3f470		0.0	32	propagandaposters	Press Forward, 2013 [EVE, Poster]	0.83	0	1	5
	hitler and goebbels as rats in a bombedout berlin world war ii poster	1373939171.0	i.imgur.com	True	1idsep	https://external-preview.redd.it/hhpu7RemXUeX1Vo2vH_JSkyXqygql0seykwITeB5T20.jpg?width=320&crop=smart&auto=webp&s=60e1f062f3cb45c558d6cc4aba9b9ac849eefaea		1.0	15	propagandaposters	Hitler and Goebbels as rats in a bombed-out Berlin, 1945 [World War II, Poster]	0.83	0	1	5
hidingout2	putin holding trump as a baby	1470077365.0	i.imgur.com	True	4vo3bi	https://external-preview.redd.it/G82Z7Y8lbn-TZ2rK9asL_K2T-OvCULJFGhp_idlJxPY.jpg?width=320&crop=smart&auto=webp&s=33585ff647caceb2b1eaba6e9c471be5e64f672e		13.0	127	propagandaposters	Putin Holding Trump as a Baby | Modern	0.93	0	1	5
smallteam	the iraq campaign a television history	1460680350.0	youtube.com	True	4eu7o9	https://external-preview.redd.it/9hoBfwRgdvav5oTgdrLp5tgGWOjepQjTyULiYza7oJA.jpg?width=320&crop=smart&auto=webp&s=e2305d81ee8500404d486bd17ba04aa7e2de287d		0.0	4	propagandaposters	The Iraq Campaign 1991: A Television History | © (1992) Phil Patiris, Modern Television | A video culturejamming critique of television news coverage of Desert Storm (the first Iraq War)	0.84	0	1	5
Geeglio	dutch antinixon poster comparing richard nixon with adolf hitler the netherlands	1499697200.0	i.redd.it	True	6metb8	https://preview.redd.it/oib72h0izr8z.jpg?width=320&crop=smart&auto=webp&s=170153388c1c9ba18e92c455349542b48ba97568		9.0	58	propagandaposters	Dutch anti-Nixon poster comparing Richard Nixon with Adolf Hitler, The Netherlands, 1973	0.95	0	1	5
GreatDario	more than ever a working class popular front spain s	1488171841.0	i.redd.it	True	5wev1y	https://preview.redd.it/wqvu2ina1ciy.jpg?width=320&crop=smart&auto=webp&s=4caaceb7f880640d77185ead9013e8507804db45		2.0	33	propagandaposters	"""More than ever, a working class."" Popular Front, Spain, 1930s."	0.9	0	1	5
TommBomBadil	no use adolf you cant shut out that hum	1451145296.0	i.imgur.com	True	3yamjs	https://external-preview.redd.it/v6kYkkGfhulkV_X9rkcdkfZd2TlEHMxIN6zvGTXt3Ag.png?width=320&crop=smart&auto=webp&s=de2c26f11528a5c623b3af2f6d2d6ba3c70c86ec		20.0	367	propagandaposters	No Use Adolf - You can't shut out that hum. (1943)	0.96	0	1	5
GreatDario	in the drumfire of the western front germany	1505021927.0	i.redd.it	True	6z6nt3	https://preview.redd.it/623z8k1ctzkz.jpg?width=320&crop=smart&auto=webp&s=c747feddf7ae8948936c3f2b36aed7106fbc5a03		8.0	77	propagandaposters	In The Drumfire Of The Western front (Germany, 1936)	0.94	0	1	5
heiligenschein	orthodoxy or death russian traditionalist banner religion monarchy	1367355066.0	imgur.com	True	1dfp41			18.0	56	propagandaposters	"""Orthodoxy or Death,"" Russian traditionalist banner, 2010 [religion, monarchy]"	0.93	0	1	5
ithyphallic6	five per a bayonet shish kebab bulgarian poster from the first balkan war	1498576761.0	imgur.com	True	6jtcym	https://external-preview.redd.it/pCeQ4yCspEVm5nLKbgc4MhDckWup9j-R7TUTivWrJFg.jpg?width=320&crop=smart&auto=webp&s=ae71091b1c7b545a80696a976dafd13f1cb56031		4.0	25	propagandaposters	"""Five per a bayonet (shish kebab)"", Bulgarian propaganda poster from the First Balkan War (1912-1913)"	0.91	0	1	5
commieflirt	another face of military occupation cover for an issue of the pflp bulletin	1467220199.0	i.imgur.com	True	4qgnta	https://external-preview.redd.it/42bTsm7yw6ZT5XLGxieZi4fvGzaxzBLGpCIKNNdHR18.jpg?width=320&crop=smart&auto=webp&s=51e8bffe04254e4902d249893f18c38a312c5a68		13.0	283	propagandaposters	"""Another face of military occupation,"" cover for an issue of the PFLP Bulletin, 1982"	0.96	0	1	5
tyrroi	petturin palkka on kuolema traitors reward is death finnish s	1406486875.0	i.imgur.com	True	2bvjy2	https://external-preview.redd.it/21UvSWvxPx-56Zo5eUoYofzKU_mFR3TY925oTeUP24g.jpg?width=320&crop=smart&auto=webp&s=3b48e1a9bfa98351ca596c3686e19099d3eb1b55		1.0	30	propagandaposters	Petturin palkka on kuolema (Traitors reward is death). Finnish propaganda, 1930/40s(?)	0.85	0	1	5
Bezbojnicul	relax on keplerb where your shadow always has company by nasas exoplanet travel bureau space	1420810958.0	i.imgur.com	True	2rut51	https://external-preview.redd.it/_-rG9eux1pEf7o6XiYqk3qH8G2rRbfltwhVxCknnvWQ.jpg?width=320&crop=smart&auto=webp&s=ab2a3daa27dd567f6b990c111932d53315950653		6.0	83	propagandaposters	"""Relax on Kepler-16b - Where your shadow always has company"" (by NASA's Exoplanet Travel Bureau) [2014, Space]"	0.94	0	1	5
TommBomBadil	hitler the unwise big game hunter dr seuss	1450789111.0	images.slideplayer.com	True	3xtwd4	https://external-preview.redd.it/3vzC_EeMFJCoCE-Z6pcu4vFBHpXXbOLWfbFtBoAjH3k.jpg?width=320&crop=smart&auto=webp&s=8ce236887d586ee33a892776e3f0e633529ed60f		9.0	132	propagandaposters	Hitler the Unwise Big Game Hunter - Dr. Seuss - 1941.	0.97	0	1	5
petroichor	instead of bread and earnings murder and death anticommunist poster slovenia ww	1500944988.0	i.redd.it	True	6pcux1	https://preview.redd.it/swifum862nbz.png?width=320&crop=smart&auto=webp&s=1c3a556641f618308400ce23b7e14b4c8ad850d9		2.0	38	propagandaposters	"""Instead of bread and earnings, murder and death!"" Anticommunist poster, Slovenia, WW2."	0.9	0	1	5
	young voters for the president	1481666102.0	i.redd.it	True	5i6hmo	https://preview.redd.it/z81diw03oe3y.jpg?width=320&crop=smart&auto=webp&s=5c5fcd2ba4004ad010f4e0c0aadef82301ecfcf7		3.0	169	propagandaposters	"""Young Voters for the President"", 1972."	0.97	0	1	5
rocaralonso	baut jugendherberge und heime build youth hostels and homes hermann witte	1485027861.0	i.imgur.com	True	5pcfy2	https://external-preview.redd.it/Aqd3jsk-hPVsYNWsBAIpM2IrEUA1Mb9qvaGV7ZE_-pc.jpg?width=320&crop=smart&auto=webp&s=dc83e377f276c7d06d383703362413e7761951b1		1.0	19	propagandaposters	Baut Jugendherberge und Heime (Build Youth Hostels and Homes, Hermann Witte, 1935)	0.9	0	1	5
TommBomBadil	an antinazi campaign poster from	1450786744.0	alphahistory.com	True	3xtsw7	https://external-preview.redd.it/tuUUo2gmDp_rbIZy-L1G9WqznHbjpTPWe4dTrHX7dNI.jpg?width=320&crop=smart&auto=webp&s=2236f629c8b1d3b9ff1813d6cc92da9e46c2414e		1.0	34	propagandaposters	An Anti-Nazi Campaign Poster from 1932.	0.95	0	1	5
AngelaMotorman	viet nam vencera by rene menderos s vietnam war poster	1368996394.0	iisg.nl	True	1eng29	https://external-preview.redd.it/qCgmFMLQ9u-Cnqa7vn8Ujj5Gk-fdi25PEryudy_3NCk.jpg?width=320&crop=smart&auto=webp&s=57dce93ee24d7b3e8bd8bbb26678dc1ea6da53d0		3.0	28	propagandaposters	Viet Nam Vencera, by Rene Menderos, 1970s [Vietnam War, poster]	0.83	0	1	5
Sveinlan	swedish war poster en svensk tiger had a double meaning a swede keeps his mouth shut or a swedish tiger	1470429756.0	i.reddituploads.com	True	4wcjc5	https://external-preview.redd.it/fOrjAQuZUVbwC0_k1SoH1fcToTViQa-KdD10HU3VI9Q.jpg?width=320&crop=smart&auto=webp&s=c40e76324599e769990e1d7668de777f9cc87f5e		2.0	74	propagandaposters	Swedish war poster 1941 - En svensk tiger had a double meaning. A Swede keeps his mouth shut, or a Swedish tiger.	0.92	0	1	5
NJBilbo	breaking the bottleneck state of ohio dept of highways div of traffic and safety	1364564822.0	imgur.com	True	1b8oq0	https://external-preview.redd.it/17iLAwPdube1GnkpMNyn8r1x3iXYiOfwsrGcZjF9tlA.jpg?width=320&crop=smart&auto=webp&s=2664b3c4c31d1a8c06306f15ec2b1e8d8568f3d2		3.0	137	propagandaposters	Breaking the Bottleneck - State of Ohio Dept. of Highways, Div. of Traffic and Safety, 1942	0.98	0	1	5
QuantumTwin	soviet military strictly execute soviet laws and military regulations	1424959774.0	i.imgur.com	True	2x8eh0	https://external-preview.redd.it/jcPA27dbEBS9rb1xeFvfrj0Xm2ulQVSb0ZtoBVdedTY.png?width=320&crop=smart&auto=webp&s=732197fac4415d6aa46fab3c91d44ca89ca99e1a		17.0	50	propagandaposters	"1987 Soviet Military Propaganda: ""Strictly execute Soviet Laws and Military Regulations!"""	0.91	0	1	5
whitesock	russian soldier being sodomized by a japanese soldier drawn in the style of erotic japanese shunga art	1439202517.0	i.imgur.com	True	3gg6z5	https://external-preview.redd.it/R047HDFi9w8mxctgF6OxEgRllriRMczDxfthiW_Yc24.jpg?width=320&crop=smart&auto=webp&s=d306553a73e7bcd588763c30c6fa3a99dea4f611		59.0	526	propagandaposters	"Russian soldier being sodomized by a Japanese soldier, drawn in the style of erotic Japanese ""Shunga"" art [1904-1905]"	0.96	0	1	5
mattityahu	palestinian isish intifada posters	1415747014.0	imgur.com	True	2m0jc5	https://external-preview.redd.it/QqtAWTenjny6k8EJdSh_WxFgexXDUizD8KCk_OrEk4g.jpg?width=320&crop=smart&auto=webp&s=2f50d9cc3c1daa96153c6d1ce5ee7faa069a961c		8.0	13	propagandaposters	Palestinian ISISh Intifada Posters, November 2014	0.7	0	1	5
filosoful	postcard showing hitler on the run from the nasty russian climate and a hail of red missiles wwii war	1370406633.0	i.imgur.com	True	1fpad8	https://external-preview.redd.it/4RGrZHLBNAK_Mi8iw93RpqbqoUTpUG59-ybN5ySAl28.jpg?width=320&crop=smart&auto=webp&s=ed4a631f2deaf8373af0114e9177c1eecac5703d		9.0	208	propagandaposters	"Postcard showing Hitler on the run from ""the nasty Russian climate"" and a hail of red missiles, 1942 [WWII, War]"	0.97	0	1	5
Top10AnimeChefs	anticommunist poster circa early s	1498558102.0	i.redd.it	True	6jrpoy	https://preview.redd.it/0wkdlkx3x56z.jpg?width=108&crop=smart&auto=webp&s=2d5b6bf4533985a6cd83ee3ede881aa309d44fa1		2.0	33	propagandaposters	Anti-Communist poster [Circa Early 1950s]	0.86	0	1	5
Coffeh	nuclear war perestroika period late s communism cold war poster	1392163590.0	i.imgur.com	True	1xnsio	https://external-preview.redd.it/QO4QDxIbC73KXnyRFf4iEvCNlhUDy8UOAff5ZrgTadc.jpg?width=320&crop=smart&auto=webp&s=eb25870ae27ebaf97f0a148b9dab4e8b18dd9042		32.0	357	propagandaposters	"""Nuclear War"" - Perestroika period (late 1980s) [Communism, Cold War, Poster]"	0.99	0	1	5
xand_castle	columbia calls wwi us army recruiting poster	1500067785.0	i.redd.it	True	6nc1fc	https://preview.redd.it/viqsbhr2mm9z.jpg?width=320&crop=smart&auto=webp&s=97bd08eb7f582007432895f46e70706e2aaa3a36		14.0	64	propagandaposters	Columbia Calls: WWI US Army recruiting poster	0.98	0	1	5
tinteoj	keep quiet wwii new zealand loose lips exact date unknown	1388400158.0	i.imgur.com	True	1u0b8t	https://external-preview.redd.it/9fOPULGVuugfr0VfOdmRzRd1zrSi22FIefJaf83qtHw.jpg?width=216&crop=smart&auto=webp&s=8a80a993d61757ccec3531816bb5f275c8f623ec		4.0	44	propagandaposters	"""Keep Quiet!"" WWII New Zealand ""loose lips"" exact date unknown. (xpost: /r/OldSchoolRidiculous)"	0.92	0	1	5
Slameny_Hubert	agressors were found czechoslovakia	1448555529.0	imgur.com	True	3ud1zr	https://external-preview.redd.it/SuW6lpdcm7QKgTBzE0-_Krcmws8IAAKVEFIxi-adf94.jpg?width=320&crop=smart&auto=webp&s=8664f0c8c4753527475d5da330f9ca3fae36061f		16.0	478	propagandaposters	"""Agressors were found"" Czechoslovakia 1958"	0.96	0	1	5
SrFind	great meeting communism poster	1367245149.0	i.imgur.com	True	1dc71w	https://external-preview.redd.it/EebNhgKJS-FSb-mpSOUDogt7blgA8mb5R9hxe8HU3uo.jpg?width=320&crop=smart&auto=webp&s=8b9770ffe9ad8913546ca76b8bbf5e9e7440149e		33.0	201	propagandaposters	Great Meeting, 1949[Communism, poster]	0.97	0	1	5
	im nuts about jimmy	1481898761.0	i.reddituploads.com	True	5iojb7	https://external-preview.redd.it/m6xKHzESnDi8jC-48dcl73SRcd0iQH7aP42_0KIfiu4.jpg?width=320&crop=smart&auto=webp&s=54c1962bf58476b448bfe65813f9d7ba654bf235		32.0	879	propagandaposters	"""I'm Nuts About Jimmy"", 1976."	0.94	0	1	5
markypp	a handbill distributed by eglantyne jebb founder of save the children in pamphlet blockade of germany and austria	1379447266.0	imgur.com	True	1mlcnz	https://external-preview.redd.it/DDRbe2qKvmw-ZdGykCCrILm35f5R5qDj2FyXKlaKzRU.jpg?width=320&crop=smart&auto=webp&s=ce5ca5ecac7cb48209cdd09411b593136947e2ba		2.0	118	propagandaposters	A Handbill distributed by Eglantyne Jebb, Founder of Save the Children in 1919 [pamphlet, blockade of Germany and Austria]	0.93	0	1	5
outtacontext	take is cheap dont come home until you sort this mess out	1363908396.0	flickr.com	True	1arkm0	https://external-preview.redd.it/kNQExlitTYW4A0Sgn6zqPZglUF2H3jr9h8UxDc2PRhs.jpg?width=320&crop=smart&auto=webp&s=6199d3b568e15020b381481d1ff3e0f16319177b		6.0	3	propagandaposters	Take is cheap! Don't come home until you sort this mess out. 	0.8	0	1	5
randomgirltree	socialist poster	1387333470.0	i.imgur.com	True	1t4zo1	https://external-preview.redd.it/mDoiwTJm4wR4zY8RPxGbKHfHBbg4BuOJmnFjTTyVgW8.jpg?width=320&crop=smart&auto=webp&s=15f3d00222c78f4c349a6e93a2afd0fae60e7f4b		32.0	92	propagandaposters	Socialist propaganda poster, 2013 [xpost from r/socialism]	0.89	0	1	5
commissar_lubi	the crusaders australia	1497338714.0	i.redd.it	True	6gycyw	https://preview.redd.it/9xia25d07d3z.png?width=320&crop=smart&auto=webp&s=c8e8df0d5fe33b144fc24021d170323b3d83d0ba		58.0	574	propagandaposters	"""1189. The Crusaders 1915."" Australia, 1915"	0.98	0	1	5
hodor_goes_to_ny	say no to war s	1414878054.0	i.imgur.com	True	2l0eoz	https://external-preview.redd.it/BqQOgQJEt5C9J1TH43silEWi42cMfbAlGXJlhB80qcM.jpg?width=320&crop=smart&auto=webp&s=03a8a3991c58d41899304259a390c7a15777d229		1.0	90	propagandaposters	"""say NO to WAR"" 1960s"	0.96	0	1	5
Lynx_Rufus	your old new land must have you join the jewish regiment wwi era wwi recruiting poster	1390763533.0	upload.wikimedia.org	True	1w7mqw	https://external-preview.redd.it/WzuwvjLr5ijQznwXrJKkJzcmx3VgHek_HOnKSZDxl6w.jpg?width=320&crop=smart&auto=webp&s=f42f5b5cbf373835dd2b3df067a9ea406a165be4		29.0	232	propagandaposters	"""Your Old New Land must have you! Join the Jewish regiment."" WWI era [WWI, Recruiting, Poster]"	0.94	0	1	5
Pilast	palestinian berlin middle eastern politics in the german capital flyer	1390493920.0	souciant.com	True	1vy7mo	https://external-preview.redd.it/2lDE2jt9D9Ir9BELX3EF3MMM92O-KrZHCjnNNOshtQw.jpg?width=216&crop=smart&auto=webp&s=82f928a2cdc254eb660a46ed2180f5b888ba7727		0.0	7	propagandaposters	Palestinian Berlin: Middle Eastern Politics in the German Capital, 2013 [Flyer]	0.63	0	1	5
wackystuff37	toughen up americans small pamphlet circa	1371689545.0	flickr.com	True	1gp241	https://external-preview.redd.it/9vQI4hgeLIvcFy8NwVPce0LcCAf-T7_lLiDXFcyLVJc.jpg?width=320&crop=smart&auto=webp&s=a3d10057496ec317b1d7ecc9c42c6293a357a49c		4.0	65	propagandaposters	"""Toughen Up Americans!"" small pamphlet circa 1940"	0.96	0	1	5
GreatDario	workers famine approaches strikes destroy work nourishes do your duty work germany	1488152014.0	i.redd.it	True	5wd8pg	https://preview.redd.it/l8400pz9eaiy.jpg?width=320&crop=smart&auto=webp&s=9773ac6c5d1b5ed5b0311b8e220eb226a1a40d62		0.0	83	propagandaposters	"""Workers! Famine approaches! Strikes Destroy, Work nourishes! Do your Duty, Work!"" Germany, 1919."	0.96	0	1	5
