cionn	if you desire a coloured for a neighbour vote labour if you are already burdened with one vote tory british conservative party election leaflet	1374748739.0	imgur.com	True	1j0q71	https://external-preview.redd.it/3yiJXQ-mbG8SrboHknMN6vcm5p7PMMOO9W8y6pTn4eg.jpg?width=216&crop=smart&auto=webp&s=5a469adc57c5f560396de4f95c0b06056939a10b		56.0	242	propagandaposters	"""If you desire a coloured for a Neighbour, Vote Labour. If you are already burdened with one, vote Tory"" British Conservative party election leaflet 1964."	0.96	0	1	5
kenjara	th congress of the croatian communist yugoslavia croatia communism	1379888145.0	i.imgur.com	True	1mx4e2	https://external-preview.redd.it/PFTusTWtP9cd5jNUw7gf9-VWU6iEqfkPPjWsp-uURV4.jpg?width=320&crop=smart&auto=webp&s=a3db1f339f3590397b9344dbd7bed7aef888cecb		2.0	36	propagandaposters	11th Congress of the Croatian Communist, 1989. [Yugoslavia, Croatia, Communism]	0.91	0	1	5
Juqu	we dont want to fight but well defend the soviets communism poster	1366035707.0	imgur.com	True	1ce1rz	https://external-preview.redd.it/9x3Ee_VvuVUN2bof9xO7lG46f590VNMJ236E1QjBNlQ.jpg?width=320&crop=smart&auto=webp&s=10ff5025d9d2b3a7f282274bdf3f7628613e89d5		5.0	13	propagandaposters	"""We Don't Want to Fight, But We'll Defend the Soviets!"", 1922 [Communism, Poster]"	0.82	0	1	5
commieflirt	the name of lenin shines on our victories soviet poster celebrating the venera and venera missions to venus	1470866786.0	i.imgur.com	True	4x4pit	https://external-preview.redd.it/2Mz83vAFfUwLqcx-ALN8UTCMH3sa0cmmDuWskBSP7Us.jpg?width=320&crop=smart&auto=webp&s=8f293ebe6be133c403905647b99090e46e1b276c		2.0	68	propagandaposters	"""The name of Lenin shines on our victories!"" Soviet poster celebrating the Venera 5 and Venera 6 missions to Venus. 1969"	0.96	0	1	5
Windows7Guy100	tomorrows pioneers a palestinian childrens show produced by hamas and cohosted by various costumed characters including one resembling mickey mouse most of said costumed characters are killed by jews in some violent manner	1436928497.0	youtube.com	True	3dc3gn	https://external-preview.redd.it/i3ojDN13sobbP9vepGSznqaPUY7Ko_s2Rc8-3m5U-Io.jpg?width=320&crop=smart&auto=webp&s=0a97dcd3abd9413b46c62e92f1b2dc8fa8f56465		3.0	18	propagandaposters	Tomorrow's Pioneers (2007-2009), a Palestinian children's show produced by Hamas and co-hosted by various costumed characters, including one resembling Mickey Mouse. Most of said costumed characters are killed by Jews in some violent manner	0.91	0	1	5
alllie	the new deal mural dedicated to president roosevelt by conrad a albrizio painting	1371493752.0	imgur.com	True	1gj488	https://external-preview.redd.it/h0PhHlGjFWcRrAZsAARzOUnoNV2JaTloYPKeK9HGy_c.jpg?width=320&crop=smart&auto=webp&s=f0e945ddeda493ff8b1c1429ac72a104494f065c		6.0	128	propagandaposters	The New Deal, mural dedicated to President Roosevelt, by Conrad A. Albrizio, 1934 [Painting]	0.94	0	1	5
MailmanSpy	world and friend time magazine cover us	1480874104.0	m.imgur.com	True	5ggmoc	https://external-preview.redd.it/ayH2pK4HGWlhDhIz4KXEcuJ3dyk_fM8qyjplF2jQiyU.jpg?width=320&crop=smart&auto=webp&s=f943d1cbe7c4b146e9c29cd9b8035ce5a76c8359		5.0	256	propagandaposters	"""World and Friend"" Time Magazine Cover [US, 1950]"	0.98	0	1	5
TommBomBadil	freedom american style ussr s	1484073311.0	imgur.com	True	5n6quq	https://external-preview.redd.it/Up-4VUk7ni5MzWlMBQxjdBzdg6OPj8y38iG213xAiWo.jpg?width=320&crop=smart&auto=webp&s=643aaef34e5d3657fd7757dd62a10bea56833e8f		11.0	130	propagandaposters	Freedom, American Style - USSR, 1950's	0.99	0	1	5
michaelconfoy	heres a war job for you railroad workers urgently needed	1407429282.0	i.imgur.com	True	2cw9wx	https://external-preview.redd.it/6LGqoapWfSwB8WwH97wyUAY1Xm5vYTCWZSgfEkNbHEY.jpg?width=320&crop=smart&auto=webp&s=a0eab8e944270b9808eb4981b4a0791b1bee7e4b		6.0	47	propagandaposters	"""HERE'S A WAR JOB FOR You -- RAILROAD WORKERS Urgently Needed"" 1944."	0.88	0	1	5
I-am-Gizmoduck	cartoon wilsons response to the popes peace proposal united states	1504793615.0	imgur.com	True	6yngax	https://external-preview.redd.it/3eYtiNlzy7q7c5ktqit_w2627kYxb3dLcKWppP4LDd0.jpg?width=320&crop=smart&auto=webp&s=dbcb59185c4cfa1e47c0fd7018f88637a565c205		2.0	11	propagandaposters	[Cartoon] Wilson's Response to the Pope's Peace Proposal - United States - September 1917	0.84	0	1	5
rainbowjarhead	weve never been licked poster for a wwii film	1391979590.0	i.imgur.com	True	1xgkxb	https://external-preview.redd.it/1uKi1QFBDZpocBGVVQn-NL2gyHdnVm7CItD_12wOQeE.jpg?width=320&crop=smart&auto=webp&s=3186f0c55ec29373e57b6cb787a5369683ed0c9a		2.0	12	propagandaposters	"""We've Never Been Licked"" Poster for a WWII propaganda film, 1943"	0.85	0	1	5
	join the real revolution	1446547984.0	i.imgur.com	True	3rc7fc	https://external-preview.redd.it/YtM2qCVW8Y4wz4mLhMA04mqU5I_FumI_R0pS-rgFlfE.jpg?width=320&crop=smart&auto=webp&s=b16792dace1380c65152e5b6f20270b2bfb2ee36		9.0	7	propagandaposters	"""Join the real revolution"" | Another poster by the Austrian anti-immigration group ""Identitarian Movement"", featuring various European right-wing populists"	0.77	0	1	5
jaykirsch	through worlds and centuries s soviet space program art	1498050122.0	i.redd.it	True	6ilo29	https://preview.redd.it/q9x1omafyz4z.jpg?width=320&crop=smart&auto=webp&s=9f06f09dbe78321f9b31005bae2e47240150309b		15.0	531	propagandaposters	'Through Worlds and Centuries' - 1960s Soviet space program art	0.98	0	1	5
rexlibris	a typical hut in flanders ukymca	1488961626.0	imgur.com	True	5y6t6b	https://external-preview.redd.it/6RpEoou1uINqrjwEdDI74JwzV2nbX7CboBzV69BZN4g.jpg?width=320&crop=smart&auto=webp&s=1cef0713022373531b9fa0e3236320904277b259		4.0	15	propagandaposters	"""A Typical Hut In Flanders"" [UK/YMCA. 1915]"	1.0	0	1	5
Cmdr_Anders_Breivik	white primer russian neonazis childrens book s racism antisemitism ultranationalism	1375778219.0	imgur.com	True	1jstzt	https://external-preview.redd.it/LKsBLE3L5H0UXPPxftkfCgsI4jr-xrr3XNzBfP6EtI0.jpg?width=320&crop=smart&auto=webp&s=25f68c5661ba04134579ccdbe96b691a43af2d5e		95.0	210	propagandaposters	"""White primer"" - Russian neo-nazis' children's book, 1990s [racism, anti-semitism, ultranationalism]"	0.91	0	1	5
notthomyorke	kurdishprivate dutch citizens display victories against isis	1422233160.0	youtube.com	True	2to5hd	https://external-preview.redd.it/QTcHiUDXXI5RYwiExbBz7ZMjIzvcpv2pZhEbHblo5AA.jpg?width=320&crop=smart&auto=webp&s=63e565b424409b0f5f2290a9b048d3b59949a40f		5.0	9	propagandaposters	[2015] Kurdish/Private Dutch Citizens display victories against ISIS (x-post from /r/justiceporn)	0.84	0	1	5
Crowe410	join the royal marines help man the guns of the fleet british ww recruitment poster	1487117652.0	i.imgur.com	True	5u4477	https://external-preview.redd.it/ZpzFZOpghilGd7jYmIjZAjDk54lD1NsInvO_N-1SYhw.jpg?width=320&crop=smart&auto=webp&s=cc665dec3a11bd0280e53fc4338a6135d27a1509		2.0	16	propagandaposters	"""Join the Royal Marines, help man the guns of the fleet"" British WW1 recruitment poster, 1915"	0.95	0	1	5
MeeMarathi	japanese axis poster directed towards indians to support them for indian independence s	1449168549.0	imgur.com	True	3vb94t	https://external-preview.redd.it/BxktE8d31WqirCxYPq1F3UxfdjNrAowCkd0RlLUwtbE.jpg?width=320&crop=smart&auto=webp&s=33873e308a5a7b93fa0122be770fa9fe6106569b		8.0	230	propagandaposters	Japanese Axis Propaganda Poster directed towards Indians to support them for Indian Independence [1940s]	0.97	0	1	5
michaelconfoy	what are you going to do about it stay on the job until every murdering jap is wiped out	1415800195.0	i.imgur.com	True	2m2lbf	https://external-preview.redd.it/ZaWd5hQgS8R1vLuy5ciR2XCxWRgu8JZDuEynsG-vl4M.jpg?width=320&crop=smart&auto=webp&s=bfa351c26fac7b0fbf6dcb36f44efbae34536979		3.0	80	propagandaposters	"""What are YOU going to do about it? STAY ON THE JOB UNTIL EVERY MURDERING JAP IS WIPED OUT!"" 1944."	0.94	0	1	5
kegfullofshit	antipunk handbill created by a us labor party candidate illinois	1486449069.0	i.redd.it	True	5sjv7b	https://preview.redd.it/6xmej8zrpdey.jpg?width=320&crop=smart&auto=webp&s=4f4220d52c150b679e395c1d39efbe364b9c9aa0		7.0	57	propagandaposters	Anti-punk handbill, created by a US Labor Party candidate, Illinois, 1978.	0.99	0	1	5
QuantumTwin	australian ww change over to a victory job	1426676097.0	i.imgur.com	True	2zgebn	https://external-preview.redd.it/XNzwdYLOvbrYDz6hRk0JvRaTa5cUS9YrseNVBRvxCh8.jpg?width=320&crop=smart&auto=webp&s=fb018f7e5b6847b7c61e5486e92e1a5950bf38b2		9.0	295	propagandaposters	"Australian WW2 Propaganda: ""Change over to a Victory Job!"""	0.98	0	1	5
free_george_bush	sister cities city of burlington	1487479046.0	i.redd.it	True	5uwnvv	https://preview.redd.it/pm7ehhn3sqgy.png?width=320&crop=smart&auto=webp&s=e5d28ced856c1933e9823d2610c6d67900f29932		1.0	10	propagandaposters	“SISTER CITIES” City of Burlington, 1984	0.73	0	1	5
alllie	a small archive of late soviet posters some procommunist some anticommunist or antiwestern but most very good	1364221555.0	imgur.com	True	1az2mz	https://external-preview.redd.it/QeEnQeF0QoyGEXG42I1HcpHWRwHkwrMVY-bFIYBOOMY.jpg?width=320&crop=smart&auto=webp&s=4159f32d03c5132a248b8b4ca1ec1e6e33f47a12		77.0	680	propagandaposters	A small archive of late Soviet posters. Some procommunist, some anti-communist or anti-western but most very good. 	0.98	0	1	5
LaRabiaEsMiVocacion	a desire a hope a victory communist party of spain	1460650533.0	i.imgur.com	True	4ervve	https://external-preview.redd.it/hShvJ2QK8xFt8LnP7gqONHql0mSWwlyiL0ZgwIQQXI0.jpg?width=320&crop=smart&auto=webp&s=02fe59aa880ca490bcb9b363217697ebde8efba2		2.0	41	propagandaposters	"""April 17, 1873 a desire. April 14, 1936 a hope. February 16, 1936 a victory!"" Communist Party of Spain, 1936"	0.93	0	1	5
riverboatruss	uk tory party antiimmigration campaign	1451476991.0	imgur.com	True	3yrxv7	https://external-preview.redd.it/AcurFKFFNoFqnek8cSc9CDozZZ0e3VJIL3REXjMYRfw.jpg?width=320&crop=smart&auto=webp&s=be56e741674962da4c603db85d31893da43e0495		40.0	508	propagandaposters	UK Tory Party Anti-Immigration Campaign [1964]	0.97	0	1	5
thizzacre	collection of white army posters czaristera russian civil war	1367729591.0	imgur.com	True	1dpv1e	https://external-preview.redd.it/KgnSrqakTeLxzUtHRPPPokt8UlUrkP7WD1VUBD7A3MU.jpg?width=320&crop=smart&auto=webp&s=0ca1eeecff1d040c9edc0f3e9fcdf9922cf05895		17.0	211	propagandaposters	Collection of White Army propaganda posters, Czarist-era [Russian Civil War]	0.97	0	1	5
Juqu	eu the global economy leader infographic	1386361929.0	i.imgur.com	True	1s9mmf	https://external-preview.redd.it/jjZq9e07fhl0Q0Sg9-UY-i3AfjBHSfdOlBOFLs7lfic.jpg?width=320&crop=smart&auto=webp&s=b1b0c9583fbe32dc44e12ec36b4c03c5174922e3		3.0	27	propagandaposters	EU: The Global Economy Leader [infographic][2013]	0.8	0	1	5
beauseph	great war for europe russia vs turkey poster s	1448417156.0	i.imgur.com	True	3u5swx	https://external-preview.redd.it/jFSPNh74BImv3B6Um9RhjNPTGEDDE25XLGGQVYepiE4.jpg?width=320&crop=smart&auto=webp&s=137bdb90b040cee5ab631a56f3b07fb137680308		5.0	34	propagandaposters	"""Great War for Europe"" Russia vs Turkey poster, 1910s"	0.93	0	1	5
cocojombo	the blind passenger onboard the unarmed merchant ship germany	1497961845.0	i.redd.it	True	6idpvf	https://preview.redd.it/bu429pwtns4z.jpg?width=320&crop=smart&auto=webp&s=fd460773f1c9f69a4dda23a618f51716579cc129		1.0	43	propagandaposters	"""The blind passenger onboard the 'unarmed' merchant ship"", Germany, 1916"	0.95	0	1	5
zissouo	der fuehrers face by walt disney wwii cartoon poster	1369568113.0	i.imgur.com	True	1f2ssd	https://external-preview.redd.it/OObbUZsINORc3u_0CuvU85icLKS2hHi3Yf1Q2DoYBsk.jpg?width=320&crop=smart&auto=webp&s=b6abeb9b717066a17d2bb05bcec2c5bb3a02453c		18.0	210	propagandaposters	"""Der Fuehrer's Face"", by Walt Disney, 1943 [WWII, cartoon, poster]"	0.98	0	1	5
ToothlessShark	hell broke loose or the murder of louis vide the account of that unfortunate monarchs execution promonarchy th century	1420170393.0	upload.wikimedia.org	True	2r2far	https://external-preview.redd.it/Ke4AKw5dP5Sl29cw4pEKB8xT0x9hRjwWbFuhb5Fjl2Y.jpg?width=320&crop=smart&auto=webp&s=3178fde3154fef013ecca84967cd9452d463f618		1.0	38	propagandaposters	"""Hell Broke Loose, or, The Murder of Louis. Vide, The Account of that unfortunate Monarch's Execution."", 1793 [pro-Monarchy, 18th Century]"	0.87	0	1	5
tylertgbh	french nationalfront non a bruxelles oui a la france no to brussels yes to france	1449587375.0	i.imgur.com	True	3vxq4h	https://external-preview.redd.it/u8KMeIeoFE_HmY-h8SDVLgMuxc7aeUOe2BGcqMhT2g8.jpg?width=320&crop=smart&auto=webp&s=f1fb42710c12c093435142de94dd94384fe5fec6		14.0	164	propagandaposters	"[2015] French National-Front: ""Non à Bruxelles, Oui à la France!"" (No to Brussels, Yes to France!)"	0.96	0	1	5
Crowe410	for libertys sake enlist in the navy wwi usa	1482284977.0	i.imgur.com	True	5jh9xb	https://external-preview.redd.it/7Tc6jQCjHNc5fhX6yCPMsBKcpkF0Dqz2cZITrjWO6VE.jpg?width=320&crop=smart&auto=webp&s=68305041a345268d4a10dbe6005d3eadc93f0041		0.0	36	propagandaposters	"""For liberty's sake, enlist in the navy"" WWI USA"	0.95	0	1	5
amaxen	the giant and the spitty dwarf of reaction antipartisan soviet poster occupied poland post wwii	1438965707.0	en.wikipedia.org	True	3g5a0k	https://external-preview.redd.it/M2sSMFrTU19le10aS5cDIVslDe3GNJbDsaH0a0XZ68g.jpg?width=320&crop=smart&auto=webp&s=b06bf9eb8dc4864598c1c35074e1d6f7f7e0478a		0.0	2	propagandaposters	'The Giant and the Spitty Dwarf of Reaction', Anti-Partisan Soviet Poster, Occupied Poland, post WW-II	0.56	0	1	5
	news from the russojapanese war the russian railway carriage falling to the bottom of the frozen lake by utagawa kokunimasa	1410113356.0	i.imgur.com	True	2fqhk4	https://external-preview.redd.it/2zo3WnW1eldK5wssreIEcX_hOpUTStz2YBfxh3GZp8A.jpg?width=320&crop=smart&auto=webp&s=d613250bdb171bb6df5477661be746b08c4194b0		5.0	100	propagandaposters	“News from the Russo-Japanese War: The Russian Railway Carriage Falling to the Bottom of the Frozen Lake” by Utagawa Kokunimasa, 1904	0.96	0	1	5
WorldlyKeith	labor vs monopoly	1484677501.0	i.redd.it	True	5ojqjs	https://preview.redd.it/im9g8cetebay.jpg?width=320&crop=smart&auto=webp&s=b93ac9c4701f406383fa266bd765a7e782697ca9		20.0	234	propagandaposters	Labor Vs Monopoly (1883)	0.98	0	1	5
	the cow with deities a pamphlet circulated by various agorakshanasabh cow protection leagues as a protest against the muslim practice of beefeating during the british raj the darkskinned monster with the sword is kali british india antianimal cruelty religious	1438815310.0	i.imgur.com	True	3fxo7b	https://external-preview.redd.it/4Gw7AfqvF6oC-NaMazIjJaVhOuTm3duvCrrIOSSr6AU.png?width=320&crop=smart&auto=webp&s=8b1e6d151f57b20d184f0e1610195b180e49875b		5.0	59	propagandaposters	"""The Cow with 84 Deities"", a propaganda pamphlet circulated by various Agorakshanasabh (cow protection leagues) as a protest against the Muslim practice of beef-eating during the British raj. The dark-skinned monster with the sword is Kali. [British India, Anti-animal cruelty, Religious, 1912]"	0.96	0	1	5
kegfullofshit	only the hebrew banana is marked with the made in israel stamp the agricultural branch of the union for locally produced goods israel	1480514561.0	i.redd.it	True	5fpqss	https://preview.redd.it/d5o48w27kr0y.jpg?width=320&crop=smart&auto=webp&s=b5c12fc8580f772c6e33a3a907fcfe9c026daa70		14.0	99	propagandaposters	"""Only the Hebrew banana is marked with the Made in Israel stamp"", The agricultural branch of the Union for Locally Produced Goods, Israel, 1935"	0.98	0	1	5
outtacontext	im watching you politics poster	1370951240.0	flickr.com	True	1g45gd	https://external-preview.redd.it/FKYz-9iNdqTa2blfWgjyKaWAvskfXoYAeJgbNpHeG6c.jpg?width=320&crop=smart&auto=webp&s=9ce895b989518b7a8bffd0cbc30d186c09a7a60b		5.0	45	propagandaposters	"""I'm Watching You"" 2013 [Politics, Poster]"	0.73	0	1	5
ZugNachPankow	remember soviet union date unknown	1447235299.0	img-fotki.yandex.ru	True	3se2a2	https://external-preview.redd.it/jcSCfnLo1BHaXX5wV_quHI0MRFyBNp_HEseidyLOsb8.jpg?width=320&crop=smart&auto=webp&s=07b1756c4d2378de6da47e1563fd7301c7110ed9		3.0	25	propagandaposters	"""Remember"", Soviet Union, date unknown"	0.92	0	1	5
ugots	us eugenics poster advocating for the removal of genetic defectives c	1438881071.0	imgur.com	True	3g0xap	https://external-preview.redd.it/FpxkAfNl75KVSMAnHV8Wy7kGDKNb8Z-CCkrO0LZ2prY.jpg?width=320&crop=smart&auto=webp&s=2e9408bf8d440546e4cd12a362bd5357a53f5147		5.0	62	propagandaposters	"U.S. eugenics poster advocating for the removal of genetic ""defectives"" c. 1926"	0.96	0	1	5
theks	pyramid of capitalist system anticapitalist poster in english published in the usa	1408905450.0	imgur.com	True	2egn5s	https://external-preview.redd.it/PwBvmYpv5FaAnE48LhktpHb39hhWZmdhQRiFQbjtO_I.jpg?width=320&crop=smart&auto=webp&s=6eb4097b121af33ac6949e87fbdd670b578dde5b		50.0	391	propagandaposters	"""Pyramid of Capitalist System"" - Anti-capitalist poster in English, published in the USA [1911]"	0.95	0	1	5
wildeastmofo	kick their axis by paul sizer	1464616270.0	i.imgur.com	True	4lplob	https://external-preview.redd.it/T-OsRRWWyY9XRrOBoGPdr7OzuqQhdtvis9qmEq2ycHY.jpg?width=320&crop=smart&auto=webp&s=e1af3489d1b938eb21b01dd631b59410edd0510d		19.0	129	propagandaposters	"""Kick their axis!"", by Paul Sizer 2009"	0.88	0	1	5
petroichor	brother brothergunshot ww anticommunist slovenia home guard	1499693849.0	imgur.com	True	6mehia	https://external-preview.redd.it/lADBjbKc0dZ7bmpBdpt4gCmzRuEdtKNzJNwYY7E77PI.jpg?width=320&crop=smart&auto=webp&s=d3c2b861bbcdd8150fbf98b9cdc2164a503ce69c		0.0	8	propagandaposters	"""Brother, brother/gunshot"" WW2, anticommunist Slovenia (Home Guard)"	0.74	0	1	5
commieflirt	dawn in the motherland	1466886864.0	i.imgur.com	True	4pu998	https://external-preview.redd.it/ZAbfs4cYcJ5rGaCmFgqX3m1MjlD0kE6E1E58v9YeIfI.jpg?width=320&crop=smart&auto=webp&s=7de3399ac8432bbbfe3bf547c079b2578f4bfd26		12.0	47	propagandaposters	"""Dawn in the Motherland"" 1974"	0.94	0	1	5
Karpp	collection of postersimages from harakat ansar iran though many posters relate to syria modern	1385257051.0	imgur.com	True	1rbmih	https://external-preview.redd.it/rw3C157-mb0CTpawp_iy2QUuOWtOs9AaKwKVk8JT52w.jpg?width=108&crop=smart&auto=webp&s=13f10bd79b14373c26cda336f47e723faa67d7a9		56.0	189	propagandaposters	Collection of Posters/Images from Harakat Ansar, Iran (though many posters relate to Syria) [Modern]	0.95	0	1	5
optimalg	old repudiated sdap demands state pensions dutch socialist pamphlet	1462047030.0	imgur.com	True	4h5zhe	https://external-preview.redd.it/ZdGnr0VewF9FAvAdHE40_5XTtXf8-p4imoB6FT72U5A.jpg?width=320&crop=smart&auto=webp&s=76d80a5d1346a9faa8e5bc132d4dff86fb8e73a8		1.0	79	propagandaposters	"""Old, Repudiated. SDAP demands state pensions."" Dutch Socialist pamphlet, 1929."	0.99	0	1	5
Pvt_Larry	czechoslovaks join our free colors usa	1503161576.0	i.imgur.com	True	6uq4xj	https://external-preview.redd.it/rcbc6lxn7xa-x3g1Pqm1yV4hhXVSQjNt0JH5vmYJhmA.gif?width=320&crop=smart&format=png8&s=eaf43067c3bb84335cfa995a627ff372738a932d		11.0	426	propagandaposters	"""Czechoslovaks! Join Our Free Colors!"", USA, 1917"	0.95	0	1	5
The_Ayylien	enlist in the skeleton war date and artist unknown	1470886967.0	i.reddituploads.com	True	4x6414	https://external-preview.redd.it/MjNPN0PF5oQq2kG_2LEpMBDss7zKI1MS61gHncRrB1s.jpg?width=320&crop=smart&auto=webp&s=54865a6ceaff396f557a0a33ed24127e1eada830		6.0	28	propagandaposters	Enlist in the skeleton war! (Date and artist unknown)	0.93	0	1	5
michaelconfoy	cover your hair for safety your russian sister does	1436157751.0	i.imgur.com	True	3c9oe6	https://external-preview.redd.it/meDuFt-PJZu_SeBocwv8rBkiI8Ye-W-ESu602WIKlTo.jpg?width=320&crop=smart&auto=webp&s=68c3677660c3a1507ff1bd73f0b339622692bbc3		11.0	37	propagandaposters	"""COVER YOUR HAIR FOR SAFETY -- YOUR RUSSIAN SISTER DOES!"", 1941."	0.9	0	1	5
MuslimWithFootFetish	american black panthers party poster	1468798093.0	i.imgur.com	True	4tc5lv	https://external-preview.redd.it/WS0FVe3LUIsaP2h8CJqsykL9ZbcnVNNKLR_Wwzbl3L8.jpg?width=320&crop=smart&auto=webp&s=1d94b27304ce837192abae949142d4f6c179a2b8		19.0	308	propagandaposters	American Black Panthers party poster [1969]	0.91	0	1	5
isgoodlatvian	quiet know your place shut your face usa	1449016773.0	i.imgur.com	True	3v2prr	https://external-preview.redd.it/K4cDj7pDnXW54G7KjW02_7PS8CWVK9i2S1aLCs65fVY.jpg?width=320&crop=smart&auto=webp&s=f4a55d3f3bb3b17b0dd1d136aa11f559da4bc91a		5.0	27	propagandaposters	"""Quiet! Know Your Place, Shut Your Face!"" - [USA, 1942]"	0.81	0	1	5
ZugNachPankow	victory day celebrations for the defeat of nazism russia live feed	1462775150.0	rt.com	True	4iidxq	https://external-preview.redd.it/s0ow8UwBThCy84-eblGz0JMwJyVX9bPHC0WKBF0KyPo.jpg?width=320&crop=smart&auto=webp&s=e9f3a25e7c0fe1dab108adb68571d9e5388e03e1		1.0	9	propagandaposters	Victory Day celebrations for the defeat of Nazism (Russia, 9 May 2016) (Live feed)	0.84	0	1	5
sinnerG	hitler wants us to believe that democracy is dying caricature of goebbels and hitler with a collection of their messages antifascism poster	1370286772.0	i.imgur.com	True	1flkl7	https://external-preview.redd.it/wo69HRtVdBSdnAcj2syZ24SJIXql0V4mbUWRKZUEHiw.jpg?width=320&crop=smart&auto=webp&s=5ab001ab4f0165640668a3eaf1b4dc76f75f143d		17.0	187	propagandaposters	"""Hitler wants us to believe that: democracy is dying"" Caricature of Goebbels and Hitler with a collection of their propaganda messages, 1942 [anti-Fascism, poster]"	0.97	0	1	5
	comrade lenin cleanses the earth of filth russian civil war	1412216037.0	i.imgur.com	True	2i1xd3	https://external-preview.redd.it/7ObfwHWH609-nwrO2sl-NQdfojooftbc9WE_nRRmGb8.jpg?width=320&crop=smart&auto=webp&s=326236e4c9ba4f04765b487ee3d159d93e7b3922		9.0	222	propagandaposters	"""Comrade Lenin cleanses the earth of filth"" (Russian Civil War)"	0.98	0	1	5
GreatDario	our natural habitat lies here also germany	1504311599.0	i.redd.it	True	6xil6a	https://preview.redd.it/krfrv0j25djz.jpg?width=320&crop=smart&auto=webp&s=5d46f16cdf9235b4e1e19e0ad064aa69d26c5a98		11.0	62	propagandaposters	"""Our natural habitat lies here also!"" [Germany, 1933]"	0.96	0	1	5
Obiektyw1855	belgium	1458657155.0	imgur.com	True	4bhmhd	https://external-preview.redd.it/yz3iIEK1WnqQ1AFwDbCN3qAqKYxeNUIog6GpuQhaEsI.jpg?width=320&crop=smart&auto=webp&s=27be0d9abaa0d5a7d094dfe90bcc729759baac78		3.0	31	propagandaposters	Belgium 2016	0.67	0	1	5
outtacontext	healthy debate requires intelligence poster remixed	1378856614.0	flickr.com	True	1m51b1	https://external-preview.redd.it/hsDWxO4BSJJ8sfy3lwoCmPdZlU1jDnCdcyiGyxK_Yig.jpg?width=320&crop=smart&auto=webp&s=7d91edc7f717d400885899ae3a4b44d77c12d54e		6.0	118	propagandaposters	"""Healthy Debate Requires Intelligence"" 2013 [Poster, Remixed,"	0.92	0	1	5
w32stuxnet	you dont need faster broadband australian liberal government	1388725834.0	youtube.com	True	1uagoj	https://external-preview.redd.it/uxxDllzuZzzChtkO-NCumaD3J_wfNldfHIbwV8WxBKw.jpg?width=320&crop=smart&auto=webp&s=a25e83a51e7a23bdabc3c5126a945a5a25409d37		24.0	107	propagandaposters	You don't need faster broadband! - [Australian Liberal Government, 2013]	0.89	0	1	5
formlex7	defence conservative party general election poster conservative election	1393782201.0	i.imgur.com	True	1zcww9	https://external-preview.redd.it/FL-SyPalEEN4peFbgnftNLrIeFG9cSJvAanSjrdskOw.jpg?width=320&crop=smart&auto=webp&s=1c8a4c1bfa480315f6a2b57b46bc0d4af5155fea		0.0	98	propagandaposters	"""Defence."" Conservative Party General Election Poster 1992. [conservative, election]"	0.96	0	1	5
	dont trust posters inform yourselves infosecgerman pirate party campaign poster	1378389092.0	imgur.com	True	1ls7tl	https://external-preview.redd.it/OVGcSpvY0TFoZhtP_zr_OvaM-ho_mgvlJFsXvHDhucQ.jpg?width=216&crop=smart&auto=webp&s=c9b087e3006840402d7df01a6e1413e52662f301		11.0	68	propagandaposters	"""Don't trust posters. Inform yourselves!"" (infosec)(2011)(German Pirate party campaign poster)"	0.96	0	1	5
noncenestpasmoi	i shit on the aristocrats	1435323096.0	i.imgur.com	True	3b6s3w	https://external-preview.redd.it/DaXUAE4JH7Vwt_TvDa4SDtNQBjpPXYeLdJDV7eHsFXM.jpg?width=320&crop=smart&auto=webp&s=a95b97a98b7826efeab4ffa56a3ed7c4c2774a4b		18.0	362	propagandaposters	"""I shit on the aristocrats"" | French revolution satirical scene | [Circa 1790]"	0.99	0	1	5
Nortasungabe	verdunkeln dim your lights air raid precaution germany wwii	1385701912.0	dhm.de	True	1rox0x	https://external-preview.redd.it/0hjgpdVDahEppHc5Z30gFrPA69EKmNIEML1LK2F2wWY.jpg?width=108&crop=smart&auto=webp&s=5894175386fc9b990d5e70f06481ffaee3a2e7eb		6.0	59	propagandaposters	Verdunkeln! (Dim your lights), 1940 [ Air Raid Precaution, Germany, WWII]	0.95	0	1	5
maestroenglish	pro circumcision pic sa includes head sniffing	1451699020.0	imgur.com	True	3z33wo	https://external-preview.redd.it/r7Hq7unirDmw5lCZ9m7gTNQ13W26IQOXYGH0AR4mBHY.jpg?width=320&crop=smart&auto=webp&s=fe1bd4e8f4293d2e979d961b368a7206d5da2d9b		85.0	169	propagandaposters	Pro circumcision propaganda pic, S.A. (2015). Includes head sniffing.	0.93	0	1	5
AisforAtom	america is the axis of evil date unknown	1413283723.0	imgur.com	True	2j7euy	https://external-preview.redd.it/V3bs3n7MLIYSc2rYu1OsyX2lLoGI9Yk4iMeGL600fxM.jpg?width=320&crop=smart&auto=webp&s=85a65cdf2542390e843fa41634ebce0f3fe0cb54		7.0	68	propagandaposters	"""America is the Axis of Evil"" (Date Unknown)"	0.91	0	1	5
Uberrees	yes to occupied factoriesfrance situationist	1448994091.0	libcom.org	True	3v1123	https://external-preview.redd.it/ywJeV2eRzWLQG-9C9MrAefnEKelRPzdFOKDvb5uPGhs.jpg?width=320&crop=smart&auto=webp&s=530bba46fa107cc34887323b954f49f55869d62c		3.0	49	propagandaposters	"""Yes to Occupied Factories""-France 1968 [Situationist]"	0.94	0	1	5
