michaelconfoy	for motherland for stalin for peace for communism	1413548819.0	i.imgur.com	True	2jieoc	https://external-preview.redd.it/Pldq7FHxU10kwTA3nbc_3Fpp5tKupRF-tsaLtYYu4QQ.jpg?width=320&crop=smart&auto=webp&s=6493061537c179a8de302e7e7036c282fa8c122a		5.0	77	propagandaposters	"""For Motherland! For Stalin! For Peace! For Communism!"" 1950."	0.95	0	1	5
katyne	life of a woman who had an abortion vs woman who chose to give birth prolife russia	1439978426.0	imgur.com	True	3hke13	https://external-preview.redd.it/IO8LLki7aLfG-MtSvDtuKL3WtJ58XwV_SYzHyy9ZLt0.jpg?width=320&crop=smart&auto=webp&s=0825a2be8907f858ecee540d5090ad67a9dec1e5		85.0	429	propagandaposters	"""Life of a woman who had an abortion vs. woman who chose to give birth"". Pro-life propaganda, Russia, 2009"	0.96	0	1	5
hypersite	what this country needs is a good mental insecticide usa dr seuss	1485158726.0	i.redd.it	True	5pnbdb	https://preview.redd.it/o5s0jm535fby.jpg?width=320&crop=smart&auto=webp&s=e0940b2a7ec896da61e38deaaddf6d3f61fbf567		178.0	3707	propagandaposters	"""What this country needs is a Good Mental Insecticide"" USA (Dr Seuss) -1942"	0.92	0	1	5
TheUnAustralian	simple poster made by stonewall uk an organization campaigning for lgbt rights modern	1469478952.0	i.imgur.com	True	4ukrwn	https://external-preview.redd.it/mFzwRd7zCshEGnAPr29JsDbOELb4ZCJ0iYr7kBGjAQk.jpg?width=320&crop=smart&auto=webp&s=0e345faee58c9cbfaf70b5ac402348ce50b55d83		12.0	123	propagandaposters	Simple poster made by Stonewall UK, an organization campaigning for LGBT rights [Modern]	0.92	0	1	5
alllie	new german divisions soviet poster showing children in the nazi army the director of the hitler youth triumphantly reported to hitler that of the youth born in were sent to the army so of year olds were recruited to the military	1364162012.0	i.imgur.com	True	1axoxp	https://external-preview.redd.it/3ZfRXXpfhDHmMlbS-4GoZwqPIhM6EhuO9rnFXPjvOpQ.jpg?width=320&crop=smart&auto=webp&s=5fa09280bb15e817df9015f084b9aaeaa564959b		1.0	44	propagandaposters	New German Divisions, 1944. Soviet poster showing children in the Nazi army. (The director of the Hitler Youth triumphantly reported to Hitler that 70% of the youth born in 1928 were sent to the army so 70% of 16 year olds were recruited to the military.)	0.86	0	1	5
alllie	bombed women and searchlights by clive branson wwii painting	1368721942.0	i.imgur.com	True	1egivq	https://external-preview.redd.it/EeW6VEjY4ZUEyGBrvIOADDoVmW78__7Xp5Fe9mVHp-I.jpg?width=320&crop=smart&auto=webp&s=bac046c9b0e403a1e4473bf2fb91048a7d2dd8b0		2.0	20	propagandaposters	Bombed Women and Searchlights by Clive Branson, 1940 [WWII, Painting]	0.78	0	1	5
Geeglio	long live the worldwide red poster by dmitry moor russian sfsr	1501160956.0	i.redd.it	True	6pvss1	https://preview.redd.it/fzhpgs07w4cz.jpg?width=320&crop=smart&auto=webp&s=2ee9a571bfbafff14aa2f29c12323cbf97451850		0.0	74	propagandaposters	"""October 1917 - October 1920. Long Live the Worldwide Red October!"" poster by Dmitry Moor, Russian SFSR, 1920"	0.98	0	1	5
Monkey_Paralysed	picture going around on proassad facebook pages assad means lion	1410963252.0	i.imgur.com	True	2gnsxn	https://external-preview.redd.it/z1iiYelnaYOPNsAqbo18j9a0ANe0tRNUqssYLATpnXM.jpg?width=320&crop=smart&auto=webp&s=7e9de5d8fd5ad9b286bb004316623c3235ea591b		20.0	32	propagandaposters	Picture going around on Pro-Assad Facebook pages. Assad means lion.	0.84	0	1	5
badhairdee	japanese poster in the philippines world war ii	1465201517.0	psywarrior.com	True	4mryie	https://external-preview.redd.it/-1FbB1-ew6EuxnCm3na_e_tmjl9B3bRs5iTTq2duWug.jpg?width=320&crop=smart&auto=webp&s=c21b9bdad557d6a4e4af953a19d38e3d5a3e83e4		7.0	32	propagandaposters	Japanese Propaganda poster in the Philippines, World War II (x-post from /r/Philippines)	0.89	0	1	5
PropagandaPostersMod	announcing the best posters of	1485847533.0	self.PropagandaPosters	True	5r6t3w	https://external-preview.redd.it/kmm83xfeBvzVqiNBs52HfdAMhTkpm6KLQHVd6H-oVbg.jpg?width=320&crop=smart&auto=webp&s=743582e695c524f797a499f9d57c4d6eed920010		6.0	59	propagandaposters	Announcing the Best Posters of 2016	0.98	0	1	5
Moontouch	why americas military must be strong rightwing united states	1408599207.0	youtube.com	True	2e5lrl	https://external-preview.redd.it/USEy_8wWu-foS8fino40HdmUjG9wa7n_oPdSvAtjUjs.jpg?width=320&crop=smart&auto=webp&s=b037486505348d7bc92d70edae3ce6e4a9b87a2f		26.0	24	propagandaposters	"""Why America's Military Must Be Strong,"" 2014 [Right-wing] [United States]"	0.8	0	1	5
LeonardWoods	adventures and punitive expeditions of the fascist pinocchio italian comic of the fascist era	1472332299.0	i.reddituploads.com	True	4zw8ul	https://external-preview.redd.it/fQKihcnY3UumHooV13pm8KhgTWqZHb9ocMPTBYaFClo.jpg?width=320&crop=smart&auto=webp&s=886f47c1a453b86a59710d370706843c22c2d1ca		25.0	220	propagandaposters	"""Adventures and punitive expeditions of the fascist Pinocchio"" - italian comic of the fascist era"	0.97	0	1	5
RevolutionaryCommie	dont worry be happy welcome to crossmaglen provisional irish republican army ira mural on loutharmagh border	1409308914.0	i.imgur.com	True	2ewow6	https://external-preview.redd.it/RFRnyRlonyGOh8MahmKHbq47yBMD3g9dBeAU9YJzg3M.jpg?width=320&crop=smart&auto=webp&s=eaa7d8487a3e93fb631518ceeb91e79792b0d219		0.0	18	propagandaposters	"""Don't worry, be happy - Welcome to Crossmaglen"" - Provisional Irish Republican Army (IRA) mural on Louth/Armagh border"	0.82	0	1	5
Cybron	religion is poison protect your children reads soviet poster with the church on the childs left and the school on her right	1471192266.0	pbs.twimg.com	True	4xot7s	https://external-preview.redd.it/aODSxj0J-eYTA3pWaMirHCGrxkxz4hXiFAAyycCeR5k.jpg?width=320&crop=smart&auto=webp&s=88a97a3a0238a894b9567c5d1dd0b373ce990ee3		183.0	1762	propagandaposters	"""Religion is poison! Protect your children!"" reads Soviet poster; with the church on the child's left, and the school on her right. (1930)"	0.93	0	1	5
TommBomBadil	chinese revolutionary s	1484512204.0	imgur.com	True	5o66oc	https://external-preview.redd.it/f9DO1mqxERV2XCe-MLvjTl-JXsp1G7ruJpH5Sy6lGhg.jpg?width=320&crop=smart&auto=webp&s=10e833283e3cf0626ae8abe2cae0b63b9d6f24f4		2.0	14	propagandaposters	Chinese Revolutionary Propaganda - @ 1960's	0.82	0	1	5
Timfromct	ww era american proganda poster in yiddish x	1451214656.0	i.imgur.com	True	3ye0eo	https://external-preview.redd.it/FPj08gJpukZUm-0zAB11HtEEYFTw1QxianxNRq6BL5A.jpg?width=320&crop=smart&auto=webp&s=8c9d7d5dc61890f0c13ea9d67e4e579101194cb8		14.0	249	propagandaposters	WW1 era American proganda poster in Yiddish [396x599]	0.96	0	1	5
york100	hitler builds germany	1479936386.0	i.redd.it	True	5ejvca	https://preview.redd.it/1nt78cs0tfzx.jpg?width=320&crop=smart&auto=webp&s=4d440d9ca8ffd2c366a7e8dd333ebf73e6f5b39e		13.0	199	propagandaposters	"""Hitler Builds"" Germany (1933)"	0.98	0	1	5
Astrokiwi	bilingual today french tomorrow s or early s stolen from rcanada	1482229408.0	i.redd.it	True	5jckpw	https://preview.redd.it/n9exqmtewk4y.jpg?width=320&crop=smart&auto=webp&s=9ccf1df7e1df4f3167d2f6d36be54462f8c76cfa		150.0	644	propagandaposters	"""BILINGUAL TODAY, FRENCH TOMORROW"" (1970s or early 1980s, stolen from /r/canada)"	0.97	0	1	5
RobertSparrow	when in doubt ask your boss he knowshow office of war information poster featuring uncle sam s	1425925177.0	i.imgur.com	True	2ygs8s	https://external-preview.redd.it/7hfdGSQtgxMdwXuHeP_DFt7FR9BgNJs_o8PJ8vedY00.jpg?width=320&crop=smart&auto=webp&s=1fec9c9446884941b07bc246daf0d320c182c2b1		9.0	238	propagandaposters	"WHEN IN DOUBT, ASK YOUR BOSS - HE ""KNOWS-HOW"", Office of War Information poster featuring Uncle Sam, 1940s"	0.95	0	1	5
Feragorn	early socialist zionist posters	1446523534.0	imgur.com	True	3rb4m5	https://external-preview.redd.it/DGnjpn6LJr_lp6eXuJFiE4CXo0TNOyQqBxGle99Ffys.jpg?width=320&crop=smart&auto=webp&s=95062406747b6a383f735ef44150a1833e2c4d78		41.0	276	propagandaposters	Early Socialist Zionist Posters	0.98	0	1	5
TynShouldHaveLived	make contribution for the modernization of science and technology prc	1500349701.0	i.redd.it	True	6nybjw	https://preview.redd.it/r2b5j3q8w9az.jpg?width=320&crop=smart&auto=webp&s=179c7c22ccd754c78c34be74025866bef720b347		2.0	74	propagandaposters	"""Make contribution for the modernization of science and technology."" PRC-1978"	0.96	0	1	5
	ego eco date unknown	1486315604.0	i.redd.it	True	5s8m29	https://preview.redd.it/6e30drssp2ey.jpg?width=320&crop=smart&auto=webp&s=f1c7013c18c97c22f05daf86cf4cbd452ab2ef13		31.0	345	propagandaposters	"""Ego & Eco"" Date Unknown."	0.88	0	1	5
TynShouldHaveLived	long live the victory of mao zedongs revolutionary line maoist posterprc date unknown	1500442308.0	i.redd.it	True	6o6gyo	https://preview.redd.it/bppg0pzbjhaz.jpg?width=320&crop=smart&auto=webp&s=c7d5bc715e9f6ef4b0f52d8015c96190b3555bad		10.0	237	propagandaposters	"""Long live the victory of Mao Zedong's revolutionary line"" Maoist propaganda poster-PRC, date unknown"	0.95	0	1	5
RobertSparrow	beware of typhus avoid jews poster from the germanoccupied region of poland early s	1381321678.0	i.imgur.com	True	1o2421	https://external-preview.redd.it/CWL1n2I84oPrar5quxJU_-YgPy5tQjOGlBbdezn8yOo.jpg?width=320&crop=smart&auto=webp&s=70908da48da607475639b7eb56b7d04d723b6fc1		9.0	179	propagandaposters	"""Beware of typhus. Avoid Jews."" poster from the German-occupied region of Poland, early 1940s"	0.96	0	1	5
PM_ME_YOUR_SELF_HARM	anarchist books are weapons against fascism spanish civil war c	1505148731.0	i.imgur.com	True	6zgn5z	https://external-preview.redd.it/XGil5rZJW2sTPNIeCCH4EKKMsS5xryQnkmqqKg0_qDU.jpg?width=320&crop=smart&auto=webp&s=12823a7b209f643ad5db8b516ad1172a31093102		9.0	258	propagandaposters	Anarchist books are weapons against fascism [Spanish Civil War, c. 1936]	0.96	0	1	5
Aroonroon	pictures from dabiq the islamic states online magazine to january	1457790455.0	imgur.com	True	4a3vlg	https://external-preview.redd.it/W25d82qcHIlc6EB2esfDaHlpy4KDbxQR8_doOYDpAWQ.jpg?width=320&crop=smart&auto=webp&s=9dafcf364155befe7176e309791e12436fadaf72		13.0	43	propagandaposters	Pictures from DABIQ: The Islamic State's Online Magazine. 5 July 2014 to 19 January 2016.	0.9	0	1	5
Coffeesaxophonne	tough times tough duties tough hearts nazi germany wwii	1469440837.0	i.redd.it	True	4uhtz2	https://preview.redd.it/s7x9r1abwcbx.jpg?width=320&crop=smart&auto=webp&s=96b8355230cef49b3849d02a9c8ee78afd2e1a81		21.0	153	propagandaposters	"""Tough Times, Tough Duties, Tough Hearts"", Nazi Germany, WWII"	0.98	0	1	5
ZugNachPankow	the banner of his country we swept through the worlds and centuries soviet union date unknown	1447020511.0	i.imgur.com	True	3s20vh	https://external-preview.redd.it/aQa8igfSXhbYgTIXElGwZsLj_S_Q2tl8QZEDjhCGddw.jpg?width=320&crop=smart&auto=webp&s=436ede9661fffcd70e200d870ade0610a582fcf5		9.0	43	propagandaposters	"""The banner of his country, we swept through the worlds and centuries"", Soviet Union, date unknown"	0.91	0	1	5
TossMeAwayToTheMount	uncle sam and his allies	1478303780.0	i.sli.mg	True	5b74g4	https://external-preview.redd.it/6u_6HnkaIouTUPgmlcfhrcnYZnHbamZJ5z758_fh31o.jpg?width=320&crop=smart&auto=webp&s=c6cf3808efac7dc4413b3ed322f03e2be819790c		9.0	57	propagandaposters	Uncle Sam and His allies, 1917	0.99	0	1	5
Kazmarov	at high noon featuring american actor gary cooper posted before semifree elections in poland in the original high noon movie cooper carries a gun in this poster he carries a ballot paper	1393408289.0	dolearchive.drupal.ku.edu	True	1yz80i	https://external-preview.redd.it/vzepsqKlfsZ3BCeS0iuYku-1SXFfemuOU9GCPYjqhys.jpg?width=320&crop=smart&auto=webp&s=7cc7d0f6a0bb8cadc7fa6ff48882fc8b292cf83d		1.0	145	propagandaposters	"""At High Noon, June 4, 1989"" featuring American actor Gary Cooper, posted before semi-free elections in Poland. In the original High Noon movie Cooper carries a gun. In this poster he carries a ballot paper."	0.97	0	1	5
rainbowjarhead	small text ronald reagan if it takes a bloodbath lets get it over with no more appeasement concerning treatment of protesters s poster counter culture	1367960753.0	i.imgur.com	True	1dvxwb	https://external-preview.redd.it/pf_a6Q51FEby1zcRqOWf03GeRAQSpZpbZ9WK_m46-z8.jpg?width=320&crop=smart&auto=webp&s=fdbce73bac2ef156bcf3a485174ff5d2d6a0097a		2.0	54	propagandaposters	"Small text: ""Ronald Reagan, 1968: If it takes a bloodbath let's get it over with. No more appeasement,"" concerning treatment of protesters, 1970s [Poster, Counter Culture]"	0.91	0	1	5
jaykirsch	poster from oak ridge	1488811081.0	i.redd.it	True	5xtizc	https://preview.redd.it/1rj5p7jztsjy.jpg?width=320&crop=smart&auto=webp&s=2e65eb00259c079697269914f5ddda7775152922		26.0	610	propagandaposters	1947 poster from Oak Ridge	0.98	0	1	5
not_a_persona	remember swearing turns you into a moskal ethnic slur means russian modern antiswearing poster in lviv ukraine issued by the ukrainian nationalist political party svoboda	1391817725.0	imgur.com	True	1xbe11	https://external-preview.redd.it/gDkaAupEBBKywNsRrBAgVvT8WXZkwrZEwUIxDFGzJhQ.jpg?width=320&crop=smart&auto=webp&s=6c4b89d5b88fd60d5c2acfb6de90e26a8137d9b3		2.0	50	propagandaposters	"""Remember! Swearing turns you into a Moskal (ethnic slur, means ""Russian"") Modern Anti-swearing poster in Lviv, Ukraine, issued by the Ukrainian nationalist political party Svoboda."	0.96	0	1	5
MrBKainXTR	marshall plan poster	1503762431.0	i.redd.it	True	6w68sn	https://preview.redd.it/zo6uvkaor3iz.jpg?width=320&crop=smart&auto=webp&s=62a38f5fbca031ef0275f8d12294dfd76c936910		9.0	276	propagandaposters	Marshall Plan Propaganda Poster (1950)	0.98	0	1	5
GreatDario	between the hammerand the anvil france s	1488171169.0	i.redd.it	True	5wetba	https://preview.redd.it/ztmqxusyybiy.jpg?width=320&crop=smart&auto=webp&s=a14c3023365a7565f00ead375fb0f09678e5050c		2.0	61	propagandaposters	"""Between the hammer...and the anvil!..."" France, 1940's"	0.96	0	1	5
ZugNachPankow	youth to the stadiums soviet union date unknown	1483723778.0	i.imgur.com	True	5meuty	https://external-preview.redd.it/Wqn0AEQRSGAMyStiYtHRyEEtRXiKAzQVfasvOn9VbRQ.jpg?width=320&crop=smart&auto=webp&s=d367844afee247819327f2a851a997ef80bd20a8		9.0	244	propagandaposters	"""Youth - to the stadiums!"", Soviet Union, date unknown"	0.98	0	1	5
LaoBa	your place is here recruitment poster for the british ss volunteer unit legion of st george probably never used	1407181131.0	i.imgur.com	True	2cm7v0	https://external-preview.redd.it/QLi464gKQ-0lbySX0SOUQVo_qAQJDTaEsWtVf3OIH2w.jpg?width=320&crop=smart&auto=webp&s=53bb2e30e8194204293f0248a2c187948e03d379		10.0	148	propagandaposters	Your Place is Here! Recruitment poster for the British SS volunteer unit Legion of St. George, probably never used. 1943.	0.97	0	1	5
michaelconfoy	united for liberation free french produced in the united kingdom	1447479247.0	i.imgur.com	True	3sr2dm	https://external-preview.redd.it/5qrcjCoKD4yIU1Reebam_v_ekqCKoAdNBlnYK79WsEE.jpg?width=320&crop=smart&auto=webp&s=8216939fd833e11a09fd7f4d378ab18635cc19bb		1.0	94	propagandaposters	"""UNITED FOR LIBERATION"", 1944. Free French propaganda produced in the United Kingdom."	0.97	0	1	5
canyoufeelme	sons of pioneers of the universe ussr space posters	1407274904.0	imgur.com	True	2cq816	https://external-preview.redd.it/NV-Mcd2yoKBQIrsyh5JaGsXRAZeExhIB9deEBqq2HIQ.jpg?width=320&crop=smart&auto=webp&s=62d7e09a4213a42e40a07e06506c61d899647714		6.0	29	propagandaposters	"""Sons of October - pioneers of the universe!"" 13 USSR Space Propaganda Posters [1957-1963]"	0.88	0	1	5
superacetylcholine	german promilitant	1459684582.0	imgur.com	True	4d5wo2	https://external-preview.redd.it/-2dg3w1kBJiFco6bS0a-StfEe1c87PLYM9JYk2Qouww.jpg?width=216&crop=smart&auto=webp&s=bab2068a53d01bda5af2fc24bb709501e03db2d9		28.0	209	propagandaposters	[2016] German pro-militant propaganda	0.87	0	1	5
Seed_Eater	im no communist by carson robinson	1382012579.0	youtube.com	True	1on0yw	https://external-preview.redd.it/CpMA4EFcd2XY9wVN2S14kUvJ-BTtvmNJzHNwR0ZdFPY.jpg?width=320&crop=smart&auto=webp&s=1eeca41ece818f69764725d8bbcef59e16d30b5f		0.0	15	propagandaposters	I'm No Communist by Carson Robinson (1952)	0.85	0	1	5
commentor2	the joseph a labadie collection of social protest posters is now online mostly th century	1434996309.0	lib.umich.edu	True	3aqhnr	https://external-preview.redd.it/u2xjTGJXTQOkKb6Lyn27RRluhMfvcrFxwx1Qntlhmew.jpg?width=320&crop=smart&auto=webp&s=a4887996e5511249c88c19553a128020b15c1c35		2.0	16	propagandaposters	The Joseph A. Labadie Collection of social protest posters is now online (mostly 20th century)	0.94	0	1	5
Bulgakov1989	glory to myth and industry in ussr mosaics on tower blocks in balti moldova ss	1412670931.0	theblacksea.eu	True	2ijhbs	https://external-preview.redd.it/5Nyex7JYI-iuP-09Np35XZABr4zuXgtxcq_WuS2EHlM.jpg?width=320&crop=smart&auto=webp&s=ec334ff3d682d91480c3a2490350f49f128749a4		0.0	7	propagandaposters	Glory to myth and industry in USSR mosaics on tower blocks in Balti, Moldova (70s/80s)	0.9	0	1	5
Crowe410	our boys need sox knit your bit american red cross	1482098212.0	i.imgur.com	True	5j2mih	https://external-preview.redd.it/s9b683x-_vhiBVS4rNvJaKNxmzN9wVGBOkZX1i1oDDM.jpg?width=320&crop=smart&auto=webp&s=806a75cb845a1fb86ab29469cf4128970d5fc620		4.0	173	propagandaposters	"""Our boys need Sox, knit your bit"" American red cross 1918"	0.96	0	1	5
Mahtlahtli	youe country needs more paul reveresnow ground observer corps from ny transit museum date unknown	1498358215.0	i.redd.it	True	6jc344	https://preview.redd.it/oneyy7nqep5z.jpg?width=320&crop=smart&auto=webp&s=c16d2328dfe11869023bf61bf2142f76e3c7ed52		6.0	19	propagandaposters	"""Youe country needs more Paul Reveres...Now!"", Ground Observer Corps from NY Transit Museum, Date Unknown"	0.93	0	1	5
kike10	brotherhood and equality among all nations soviet victor koretsky c x	1364240154.0	imgur.com	True	1azpk0	https://external-preview.redd.it/vcTrhkK0yzznu1o2UfPwXRYXKDMUDFWuGRTTg5-hbOk.jpg?width=320&crop=smart&auto=webp&s=043644be421c7944795adad4dca51e0cf9274d6b		1.0	30	propagandaposters	"""Brotherhood and Equality Among All Nations!"" (Soviet, Victor Koretsky, c. 1960) [774x550]"	0.94	0	1	5
tyrroi	conversation across the water john bull protected by the royal navy napoleonic era propagander	1364002056.0	upload.wikimedia.org	True	1au2ui	https://external-preview.redd.it/fY629I6DtIcIt3T9e_8eER9qKRa5K3jAxwX7WActDAI.jpg?width=320&crop=smart&auto=webp&s=dd3633766c3ae2215742c937e4ce58c74922fee3		5.0	29	propagandaposters	"""Conversation across the water"" John Bull protected by the Royal Navy, Napoleonic era propagander"	0.95	0	1	5
Purpleclone	modern trumpus	1451104228.0	halhefner.com	True	3y94al	https://external-preview.redd.it/E7nGR4yPL9rAdzoKYAv-XnkMtJg01TtvTkc8Y3ZmzBU.jpg?width=320&crop=smart&auto=webp&s=ebfdde552b4eea527311d63b8bd3fbb0f51735c2		6.0	110	propagandaposters	[Modern] Trumpus	0.92	0	1	5
mrjman1	police stand with us or in front of us	1408929085.0	i.imgur.com	True	2ehn9y	https://external-preview.redd.it/vQgv4ztAf2WNlFwDHBCywhcV5qTD6zG-FnOQBKkFlzs.png?width=320&crop=smart&auto=webp&s=d3224b0b543b58a66f61bb0793c5ed8d9037c99b		20.0	58	propagandaposters	"Police ""Stand with us or in front of us"" - August 2014"	0.75	0	1	5
michaelconfoy	be true to the fuhrer saar plebiscite of	1406999358.0	i.imgur.com	True	2cfog2	https://external-preview.redd.it/oMylnyb-QxmdK_2gy7BwAd3DV7E6kR3euH4df7NPFeQ.jpg?width=320&crop=smart&auto=webp&s=3ab2b15a4a2f60dabe0d5210bdc396ea0a85288a		7.0	100	propagandaposters	"""Be true to the Führer"" Saar plebiscite of 1934."	0.95	0	1	5
theks	farewell american soldiers japanese leaflets dropped to american soldiers wwii	1408740506.0	imgur.com	True	2eb7kn	https://external-preview.redd.it/iGh_2Usj7-esU1ifhg1SjhWutYKBVryE9Dlxr5ar8Jw.jpg?width=320&crop=smart&auto=webp&s=fe9353b0df342778b3c7252f258ee6ff50b2c757		22.0	124	propagandaposters	"""Farewell, American Soldiers!"" - Japanese leaflets dropped to American soldiers - WWII"	0.98	0	1	5
ACTUALLY_A_WHITE_GUY	white zone national action glasgow postbrexit	1466968457.0	i.imgur.com	True	4pz7ew	https://external-preview.redd.it/brqHs4qpyaBSj2IbWA_x93sQW-_o-874cFWSSsJ5Mk4.jpg?width=320&crop=smart&auto=webp&s=740c317f4a7e7ba3ecb82cda825ac1ffca89c542		173.0	444	propagandaposters	"""White Zone"" National Action, Glasgow, 2016 (Post-brexit)"	0.95	0	1	5
museveni	pakistani war posters	1418793797.0	i.dawn.com	True	2pjskq	https://external-preview.redd.it/0Wu-lqV2VQU2C0JJ3WwbFCEqeEVy8jlbgGUI1f1iZZ4.jpg?width=320&crop=smart&auto=webp&s=44ba8d3bf5081f8a078aac5703159d9a1bf91c77		3.0	26	propagandaposters	1971 Pakistani War posters	0.88	0	1	5
Umanskii	nazi prehaulocaust persuasion most likely s racism national socialism	1389465170.0	imgur.com	True	1uz1l3	https://external-preview.redd.it/2Md9UZUF9j3TULNbu4inP5OrGF7s3n42SKcrGc7FrW4.jpg?width=320&crop=smart&auto=webp&s=404be9a77e2b06d3037c262a97eb5452863a471f		16.0	38	propagandaposters	Nazi Pre-Haulocaust Persuasion Propaganda [most likely 1930s] [Racism] [National Socialism]	0.83	0	1	5
ZugNachPankow	italy resurrect fight and win celebrating the th anniversary of wwi italy	1434779776.0	i.imgur.com	True	3ahifz	https://external-preview.redd.it/bLNwL-z2P95PFldJKwpxKyVYP00Am2Vx0oyc9YoqNfo.jpg?width=320&crop=smart&auto=webp&s=be4e993200211778b93c81de28f452ee992a82fb		3.0	21	propagandaposters	"""Italy: resurrect, fight and win"", celebrating the 100th anniversary of WWI (Italy, 2015)"	0.84	0	1	5
poowbag	ira no freedom until freedom of women early s	1445630933.0	i.imgur.com	True	3py5do	https://external-preview.redd.it/QgurL1licMceDgeAuunXHnQ8gqM_xyqIKYTIkSwSuyg.jpg?width=320&crop=smart&auto=webp&s=84e58c501e0a1d654215a0ff1d988d337958bfac		4.0	38	propagandaposters	"IRA propaganda ""No Freedom, Until Freedom, Of Women"" (Early 1980s)"	0.98	0	1	5
Holves	fascism we are worse poland farright	1426720215.0	imgur.com	True	2ziwk1	https://external-preview.redd.it/O_qSF31qohy8N3n_OT_RVY_8clk4chzaE6MA2KNjsV8.jpg?width=320&crop=smart&auto=webp&s=dacbdfebac3c1ce36e14493e900aa55772aa6ee6		52.0	150	propagandaposters	"""Fascism? We are worse!"" Poland, Far-right, 2007"	0.95	0	1	5
alllie	joseph goebbelstm by aleksandar macasev poster	1369882370.0	i.imgur.com	True	1fb9wg	https://external-preview.redd.it/DMHUPIE4Oc5Y37NBCphz9ESn4XqW9Mv_Vpcw9TU-AJY.gif?width=320&crop=smart&format=png8&s=eb5229565fa759e69d1ee4820dab977b487ecb36		11.0	13	propagandaposters	Joseph Goebbels™ by Aleksandar Maćašev, 2005 [Poster]	0.67	0	1	5
kameradM	im a navy man come and join me dutch east indies	1480948254.0	i.imgur.com	True	5gm6av	https://external-preview.redd.it/hWKkgg-ZwuihdfGFvq4bQT1WokS19nsteAQaHAaXN3o.jpg?width=320&crop=smart&auto=webp&s=5466eb32f4b032c9d3498c6af829920076ac4700		5.0	33	propagandaposters	I'm a Navy Man, Come and Join Me! (Dutch East Indies, 1941)	0.95	0	1	5
Crowe410	defend him by gino bocasile italy	1485899408.0	i.imgur.com	True	5rb9gx	https://external-preview.redd.it/w34MDieEopm8P1niKvtf4YsyuDXd7Fhm9rgpY9UHdcY.jpg?width=320&crop=smart&auto=webp&s=bfcfae1cf657bf32ea44d4c11423e658ddf0b0c0		6.0	135	propagandaposters	"""Defend Him!"" By Gino Bocasile, Italy, 1944"	0.99	0	1	5
noncenestpasmoi	never forgive never forget poster about clement meric antifascist activist killed in modern	1437549197.0	imgur.com	True	3e6822	https://external-preview.redd.it/2ztx27Sz-o-1VjGG9GCluu_7Q2H9ltnwz_wRRCaZxnw.jpg?width=320&crop=smart&auto=webp&s=c9602197382c4a74b7a94c80285b443dff61c3ab		8.0	25	propagandaposters	"""Never forgive, Never forget"" - Poster about Clément Meric, anti-fascist activist killed in 2013 - Modern, 2013"	0.86	0	1	5
TommBomBadil	my soldiers are always with me	1450948413.0	imgur.com	True	3y2f56	https://external-preview.redd.it/b3p4YKddJphiZEB3x8QpEsMKBQLSIC6FuMfOlXTebl4.jpg?width=216&crop=smart&auto=webp&s=b6d31d65de94e53c0bf64f67ec04219e02a15167		2.0	29	propagandaposters	"""My soldiers are always with me!"" (1943)"	0.89	0	1	5
	the clawed italian invader seeks to enslaverepublican c	1407105197.0	i.imgur.com	True	2cjbkm	https://external-preview.redd.it/FkGR5sGKhM-pILLJ7LOr7AfdAygYBow-fTxlIFEi5oM.jpg?width=320&crop=smart&auto=webp&s=bc1a97444014ec1a124429274f9245d45971662a		2.0	31	propagandaposters	"""The clawed Italian invader seeks to enslave""--Republican propaganda c. 1936-39"	0.87	0	1	5
michaelconfoy	maneater a british poster based on a drawing by an unidentified soviet artist	1425620018.0	imgur.com	True	2y3yvm	https://external-preview.redd.it/PTBrOXsvOT8wxAeAy-xn98nDEeKvDO0oOdCxvej1oK0.jpg?width=320&crop=smart&auto=webp&s=38be47071babd1928a22ef041e25857c9e131ed0		2.0	42	propagandaposters	"""Maneater"", a British poster based on a drawing by an unidentified Soviet artist, 1941."	0.93	0	1	5
surinam_boss	where are you from simon kneebone modern	1464599199.0	i.imgur.com	True	4lopxx	https://external-preview.redd.it/qk75MW3FVfIUkup7nN9FMv-3MXDAsF82xX4dM-XqZYA.jpg?width=320&crop=smart&auto=webp&s=c781a227c889c88035d7b0c928ee20d8ba613f7c		21.0	102	propagandaposters	"""Where are you from?"" Simon Kneebone, Modern"	0.87	0	1	5
MiskaMeMeMe	your scrap brought it down united states wwii	1502375149.0	imgur.com	True	6stn41	https://external-preview.redd.it/r0-KmegUXCNoiQ_GSELe39vjKhPejZAgjjWCH1DsiQE.jpg?width=320&crop=smart&auto=webp&s=bbf47a51128adccdecc078377dd4f9c2c139cb69		2.0	136	propagandaposters	YOUR SCRAP . . . brought it down (United States / WWII)	0.99	0	1	5
5_Frog_Margin	post civil war liberian billboards pt the rebuilding and election	1437008548.0	imgur.com	True	3dg94k	https://external-preview.redd.it/8RvjlOA90zW_B-g0R888atY5Z_dIq-cbkInjNePTqnY.jpg?width=320&crop=smart&auto=webp&s=dd6d1c50a7f2f31bf91c0d04bb4382876f74be84		1.0	41	propagandaposters	Post Civil War Liberian Billboards, Pt.2- The Rebuilding and 2005 Election	0.94	0	1	5
redditmortis	long live the paris commune	1450641049.0	imgur.com	True	3xm0zt	https://external-preview.redd.it/l_gxeIFu8a7gJcPXehvx9OeCQCDeT75irr8BZO35R2M.jpg?width=320&crop=smart&auto=webp&s=e432fa301a7f3c6cab9b39ff0cdaf2aedd95c363		16.0	123	propagandaposters	"""Long Live the Paris Commune"" [1971]"	0.98	0	1	5
