divinesleeper	he cant do it alone proempire long long ago date unknown	1469875157.0	bensbargains.com	True	4vblj5	https://external-preview.redd.it/5n-2u3n-uCbADe6Zmh0bNsNynipPb_aroXvZhJW6Oe4.jpg?width=320&crop=smart&auto=webp&s=d30bcaec0e8f709cf0a14e0244229149b12da40b		36.0	956	propagandaposters	He can't do it alone [Pro-Empire] [Long, long ago] (date unknown)	0.93	0	1	5
spdk187	slow down industrial worker usa	1483362498.0	imgur.com	True	5ll60a	https://external-preview.redd.it/UWn0GhzUNo4LmJ8mNDiZe-NpTypFPFGVtSH-JKeq5-E.jpg?width=320&crop=smart&auto=webp&s=f6dbd271d48a0b0ca21c26d5eef362e933293c36		17.0	221	propagandaposters	SLOW DOWN, Industrial Worker (April 1976, USA)	0.97	0	1	5
DerpBikes	people and the army together warning watermark syria modern date na	1443704077.0	i.imgur.com	True	3n3i18	https://external-preview.redd.it/SgwWlmVskjmcDQzoTUFUVbVjK_viO55eP_Qxl1g0ZMI.jpg?width=320&crop=smart&auto=webp&s=80e3f6a8069408660ca9b2441141810d2fa194c4		2.0	11	propagandaposters	People and the army together (Warning: Watermark) [Syria, Modern, Date N/A]	1.0	0	1	5
5_Frog_Margin	vote for dewey kill the klan us presidential election	1437283046.0	s-media-cache-ak0.pinimg.com	True	3dt5sr	https://external-preview.redd.it/LEPmymWR0Ajw-IWi9CGnfoyzsPn3pZhgcQcZu9Somcc.jpg?width=320&crop=smart&auto=webp&s=c13087fb7e9893572371d8313014cae98ae5926d		10.0	54	propagandaposters	'Vote for Dewey - Kill the Klan' (US Presidential Election, 1944)	0.96	0	1	5
Plethorian	little fers are tough to avoid wpa	1419981170.0	imgur.com	True	2qv23h	https://external-preview.redd.it/RgE_AomgmMFTq9LKt0WzTtTlSaul_uD_yT8z3XyF2ac.jpg?width=320&crop=smart&auto=webp&s=dc7c7bed7c40b082e8f2c5c2daabcdb0ca407d6b		13.0	189	propagandaposters	Little F*#%ers Are Tough to Avoid!; 1940; WPA	0.91	0	1	5
petroichor	in the name of peace soviet space race s	1501018230.0	imgur.com	True	6pje70	https://external-preview.redd.it/UlSUd0T1b7q8numxILF9yzbjJBb1Z24pubgSiUjCN2I.jpg?width=320&crop=smart&auto=webp&s=4de7a8b39a746c066e554de20c81117101c22f1f		8.0	76	propagandaposters	"""In the name of Peace! Soviet Space Race Propaganda, 1960s"	0.94	0	1	5
amaxen	compromise with the south s thomas nast us pro union pro war	1485821953.0	i.redd.it	True	5r4poq	https://preview.redd.it/krw7vypuxxcy.jpg?width=320&crop=smart&auto=webp&s=758019b01b01c458a3859bbef51002cb78aa3969		2.0	42	propagandaposters	'Compromise with the South', 1850s, Thomas Nast, US, pro Union, pro war.	0.99	0	1	5
DiscoHeaven	pro hijab head covering billboard modern religion	1366905626.0	i.imgur.com	True	1d38ay	https://external-preview.redd.it/-xZMoz4aMTeXynFzu6EGe-t_qQpf2r1xkqv2nmweBno.jpg?width=320&crop=smart&auto=webp&s=c015a8248b6c5a99d6efbc9efbc957a834e03a74		134.0	713	propagandaposters	Pro hijab (head covering) billboard, Modern [Religion]	0.93	0	1	5
Thatonegoblin	jeff davis president of traitors robbers and pirates united states american civil war exact date unknown	1409961462.0	library.brown.edu	True	2flhvc	https://external-preview.redd.it/Lw-J8nHKungVKfSWOFRed0iBjdr0OK_Xz59a-TUxP9g.jpg?width=320&crop=smart&auto=webp&s=cdd072e7ecf43dfa9716472c4db90829ef7466c4		9.0	144	propagandaposters	"Jeff. Davis, ""President"" of Traitors, Robbers, and Pirates... United States, American Civil War, Exact Date Unknown"	0.95	0	1	5
TommBomBadil	tsar pope and the rich on the workers shoulders russian civil war	1496376950.0	imgur.com	True	6es5st	https://external-preview.redd.it/f1o4zJc55ncNwaPZTqddeTaowXDL5LaEEJWbw1D89NM.jpg?width=320&crop=smart&auto=webp&s=3c58ddec50800dc573692a624c5b0f0ec078ad07		2.0	48	propagandaposters	Tsar, Pope, and the Rich on the Worker's Shoulders - Russian Civil War @ 1920	0.97	0	1	5
UghSheGiggin	es mi pro pia vida abortion rights cartoon el salvador c	1480483041.0	i.imgur.com	True	5fnur9	https://external-preview.redd.it/uy--Gcg7jxpGFyqtrUpU04sNn6TUyBZ0dVel2hhoedc.jpg?width=320&crop=smart&auto=webp&s=8f94837489d805c94c1e4d4160257c4323a93c7d		18.0	403	propagandaposters	"""Es Mi PRO Pia Vida"" - Abortion Rights Cartoon; El Salvador, c.2013"	0.9	0	1	5
KevlarYarmulke	anti mario bros date unknown fictional	1472133581.0	i.redd.it	True	4zim8u	https://preview.redd.it/ffqpl36w1jhx.jpg?width=320&crop=smart&auto=webp&s=102019dbf5f17f3f73041ef604c462b19600595a		40.0	1258	propagandaposters	Anti Mario Bros. propaganda, date unknown (fictional)	0.91	0	1	5
michaelconfoy	go ahead please take day off ca	1422723484.0	i.imgur.com	True	2ubfvw	https://external-preview.redd.it/VW3dFtL_hK5FngIvqmWor98tgFSZscvdAe5UMUn0GPg.jpg?width=320&crop=smart&auto=webp&s=083f00e86e536424463e0cce9a3ba1d6e200ba50		29.0	368	propagandaposters	"""Go ahead please -- TAKE DAY OFF!"" ca., 1942."	0.96	0	1	5
LaoBa	who of these two is the real dutchman recruitment poster for volunteer legion netherlands a waffenss unit	1435496950.0	i.imgur.com	True	3bedkq	https://external-preview.redd.it/enkk_ryDc9mBgG_VV-J3a2yZ32pJJGLRw2QhxlVXwDg.jpg?width=320&crop=smart&auto=webp&s=6b676e4285f922cc1a62d6c8e0433cc53aacd789		41.0	266	propagandaposters	Who of these two is the real Dutchman? Recruitment poster for Volunteer Legion Netherlands, a Waffen-SS unit.	0.97	0	1	5
GoetzKluge	anti papal painting king edward vi and the pope estimates vary from to s	1465032316.0	commons.wikimedia.org	True	4mhly6	https://external-preview.redd.it/mr2c-H4QsHqiN3CQ0s2THQmt9_Kc8xnYDervG7t8TFo.jpg?width=320&crop=smart&auto=webp&s=737027f8c4836f7155adfebcc44541e92b7650b3		5.0	22	propagandaposters	"Anti papal propaganda painting ""King Edward VI and the Pope"" (estimates vary from 1547 to 1570s)"	0.92	0	1	5
booksworm	they will beat their swords into plowsharesswitzerland s	1462112859.0	i.imgur.com	True	4h98mq	https://external-preview.redd.it/9MWii8n3QRz4GKSxG2PQNXBaaJeTG6Z32khFDKBV0h4.jpg?width=320&crop=smart&auto=webp&s=f50a96778e49d97491be15d4569abf21420a8896		1.0	45	propagandaposters	"""They will beat their swords into plowshares.""(Switzerland, 1920s)"	0.98	0	1	5
Pilast	earthquake weather natural disasters in italy genoa flyer translation commentary	1418323736.0	souciant.com	True	2ozw8m	https://external-preview.redd.it/8kKk6nrGkiTbA_pBa8XTCkMY0J1MypBOrsTUZgwf5zI.jpg?width=216&crop=smart&auto=webp&s=0a5546048a9c10f8ff6acfebffe9f73eb4347d77		0.0	7	propagandaposters	Earthquake Weather: Natural Disasters in Italy, Genoa, 2012 [Flyer, Translation & Commentary]	0.71	0	1	5
michaelconfoy	on her their lives depend women munition workers enrol at once	1441850388.0	i.imgur.com	True	3kc2s2	https://external-preview.redd.it/nD4q__CSCdh468p9QC-ENDNmRQrgVo8kY7lQ8wHaZFA.jpg?width=320&crop=smart&auto=webp&s=879c0b0bb3dd6bcc416d7e35d19ff6dc9f0d6c66		1.0	36	propagandaposters	"""ON HER THEIR LIVES DEPEND -- WOMEN MUNITION WORKERS -- Enrol at once"", 1916."	1.0	0	1	5
superegz	animal farm cover	1494936117.0	orig08.deviantart.net	True	6bh17b	https://external-preview.redd.it/CnMUDPND7_4_ku6dh0T7e2BZhXrEvDHvyLOXqJIEXmg.jpg?width=320&crop=smart&auto=webp&s=50a403fb2e37ee1d03b343267f339a40450a4351		29.0	507	propagandaposters	Animal Farm cover, 2008	0.95	0	1	5
	newsleak embarrasses white house	1488043843.0	i.redd.it	True	5w565k	https://preview.redd.it/5fa1el0qg1iy.jpg?width=320&crop=smart&auto=webp&s=33fa8eb1f2e614e63c748999b4bc4fc78c577d4b		175.0	10608	propagandaposters	"""News-Leak Embarrasses White House"" 1972."	0.91	0	1	5
hypersite	produisons francais lets manufacture french style with french peoples france national front party	1484901177.0	i.redd.it	True	5p2t17	https://preview.redd.it/byhbaz49vtay.jpg?width=320&crop=smart&auto=webp&s=9f4f90776168d07d3a4bc8eb67a4ea42b6e1dd1a		4.0	53	propagandaposters	"""Produisons français"" (Let's manufacture French style with French peoples) 1992, France (National Front Party)"	0.91	0	1	5
motke_ganef	europa is aangetreden dutch nazi waffenss ww	1393874402.0	image.invaluable.com	True	1zggk5	https://external-preview.redd.it/KQIJx0-LglFvR3WetVylDrcDwVHq84FGqFf-95XeNnA.jpg?width=320&crop=smart&auto=webp&s=dc43e0d73c0c145aa321e99695942d7c10b3ce64		11.0	26	propagandaposters	Europa is aangetreden [Dutch] [Nazi] [Waffen-SS] [WW2]	0.88	0	1	5
RetakeEverything	a mighty faggot queers against fascism anarchism banner lithuania	1380604400.0	i.imgur.com	True	1nhqoy	https://external-preview.redd.it/l2rfIZ3tSoFUqn3LgjEs5ZS7fRNqQ1plNdHqRBokVHU.jpg?width=320&crop=smart&auto=webp&s=08efe7ceea971a21289100acedf110af2e107dc1		41.0	816	propagandaposters	"""...a mighty faggot!"" Queers (A)gainst Fascism, 2012 [anarchism, banner, Lithuania]"	0.93	0	1	5
michaelconfoy	the book for germans mein kampf over million sold	1421597642.0	i.imgur.com	True	2su7d7	https://external-preview.redd.it/P-ywGafWBxhxlGwKB2G-nkEXY4JrxIJ_sIQU2nf4674.jpg?width=320&crop=smart&auto=webp&s=08266c3746386c3d1ff0f041bac8789a9ecf39b7		12.0	117	propagandaposters	The book for Germans Mein Kampf Over 4 million sold, 1938.	0.97	0	1	5
LaoBa	million indonesians are being gagged dutch communist election poster	1426888158.0	i.imgur.com	True	2zqumw	https://external-preview.redd.it/uAKEKjx7M99y_Ffx9Pqx7g-RFuRg8GIn1zJmY3qP-9k.jpg?width=320&crop=smart&auto=webp&s=4b4dbe244ecc5bbc277f11a8c95e005e2689ffea		3.0	41	propagandaposters	"""50 million Indonesians are being gagged."" Dutch Communist election poster, 1929"	1.0	0	1	5
Vasconium	you stay in unlicensed tourist accommodation i have to move out of my neighborhood barcelona city council psa advising against house rentals offered via airbnb and similar sites spain modern	1469393344.0	imgur.com	True	4uez29	https://external-preview.redd.it/IYm-TxEoRA7k9R0A1QzV9TGooS27lqRMANPnNspSiYc.jpg?width=320&crop=smart&auto=webp&s=be6a663b81a107a154874f5e4ab562904fd145bc		17.0	60	propagandaposters	"""You stay in unlicensed tourist accommodation, I have to move out of my neighborhood"" Barcelona city council PSA advising against house rentals offered via Airbnb and similar sites [Spain, Modern]"	0.95	0	1	5
pimpertje	australias identity crisis australia	1457790899.0	upload.wikimedia.org	True	4a3wev	https://external-preview.redd.it/eNnO0p-YLSl0t4_kkWaciRHv6iMa5EHiXMbGS66Fbyk.gif?width=216&crop=smart&format=png8&s=a4f8fa680990ea2bdf2d38380170a4cce3a1b761		5.0	88	propagandaposters	Australia's identity crisis, Australia, 2000	0.95	0	1	5
FNaXQ	this is no time to be frail bread is basic fleishmanns yeast ad in the saturday evening post	1500599618.0	i.imgur.com	True	6okq5g	https://external-preview.redd.it/ASjADqNEY4Z4Ekd2r9MkNKhaVTN9LER34MdQ-bJN0dg.png?width=320&crop=smart&auto=webp&s=2373cb4b2d927c939a11a5b577c0f6fc89f24c4e		0.0	20	propagandaposters	"""This is no time to be FRAIL! Bread is basic"" - Fleishmann’s Yeast ad in 'The Saturday Evening Post', December 5, 1942"	0.93	0	1	5
Graf_Leopold_Daun	kingdom of italy first world war it italian infantry advancing supported by a angel battle of piave river	1488214782.0	s3-eu-west-1.amazonaws.com	True	5whuvf	https://external-preview.redd.it/CeKHThNyHmicvsR9-ZbquP0mfr1ziuhEF9oDKzUsBSc.jpg?width=320&crop=smart&auto=webp&s=0eba689c9a30e7038271dd112c7c93e45f670144		3.0	102	propagandaposters	Kingdom of Italy propaganda first world war it Italian infantry advancing supported by a angel battle of Piave River, 1918.	1.0	0	1	5
TheGuardianGI	our land is famous for its heroes ussr	1466403609.0	i.imgur.com	True	4oxcrc	https://external-preview.redd.it/biR8qb1knMOb_xgchEtzYKHM8_h-JO132FQgvd1-dQA.jpg?width=320&crop=smart&auto=webp&s=aedde0ab646103db057cd85b3f2df10a9c4486fb		4.0	128	propagandaposters	"""Our land is famous for its heroes!"", USSR, 1941"	0.97	0	1	5
michaelconfoy	before unemploymenthopelessnessdesolationstrikeslockouts today workjoydisciplinecamaraderie give the fuhrer your vote from the referendum	1406379393.0	i.imgur.com	True	2bry7u	https://external-preview.redd.it/MNodhWwu5HUUduiF7hSdMi9V_HtEds1wo_XQOa11Sjc.jpg?width=320&crop=smart&auto=webp&s=37180c4165bc8374f7a69ca53ca63d176e2cd95c		1.0	39	propagandaposters	"""Before: Unemployment-Hopelessness-Desolation-Strikes-Lockouts Today: Work-Joy-Discipline-Camaraderie Give the Führer Your Vote!"" From the 1936 referendum."	0.88	0	1	5
Voltairinede	rise up in defence of the heroic palestinian people iranian students association in the us berkeley california early s	1405045219.0	38.media.tumblr.com	True	2ae2gd	https://external-preview.redd.it/jDy4DCLTInDlyywmbrQ4RtnwEjd1X-9utT-iTDK6Crw.jpg?width=320&crop=smart&auto=webp&s=46b14850de84ab28b2cf47f6117e39bdb87fbc1a		0.0	29	propagandaposters	'Rise Up In Defence Of The Heroic Palestinian People', Iranian Students Association in the U.S., Berkeley, California, [early 1970’s].	0.91	0	1	5
rpilek	never again a poster printed right after the first world war in	1419377465.0	i.imgur.com	True	2q8379	https://external-preview.redd.it/SXsyj5FLStmrtM5A7woJ2m2wygIJ1aiU5EPPFNrmoqk.jpg?width=320&crop=smart&auto=webp&s=917a9389d3ad633de2aa2b0a7e264ab24928922e		16.0	50	propagandaposters	"""Never again!"" A poster printed right after the first world war in 1918."	0.91	0	1	5
TommBomBadil	poster for the movie about dong cunrui soldier for the chinese revolution who gave his life for the cause	1500589995.0	imgur.com	True	6ojtnu	https://external-preview.redd.it/kjKMybQmDmgUtRvXfZqgZlsF2apv4NqmbgUnj6gO5hI.jpg?width=320&crop=smart&auto=webp&s=605519a2aa2f22b1f09dfc8392220353a6084483		3.0	28	propagandaposters	Poster for the movie about Dong Cunrui, soldier for the Chinese revolution who gave his life for the cause - 1955	0.98	0	1	5
Timfromct	polish resistance poster satirizing the german motto god is with us ww era x	1462633299.0	i.imgur.com	True	4iaacv	https://external-preview.redd.it/ojNplfTvx-EbV2zuqbtIDzRFM9fLFX8yAdUTLBkqhz8.jpg?width=320&crop=smart&auto=webp&s=790ef0ce80de8661425a3544d53c9ef003ea30de		1.0	71	propagandaposters	"Polish resistance propaganda poster satirizing the German motto ""God is with us"" WW2 Era [452x600]"	0.96	0	1	5
MailmanSpy	when you see a cross remember the gruesome murder of the jews on golgotha antisemitic for children	1467827538.0	i.imgur.com	True	4rjsjm	https://external-preview.redd.it/HVTBLG0Hfllhx43SLyUIcyLR3mVRJ2cpdzb5_MDX5Gw.jpg?width=320&crop=smart&auto=webp&s=226536065bafffc9e2750830de833be1dcb8a744		17.0	75	propagandaposters	“When you see a cross, remember the gruesome murder of the Jews on Golgotha...” Anti-Semitic Propaganda for Children [1938]	0.94	0	1	5
supermelon928	toast by mayo us wwi recruitment approx	1501602402.0	imgur.com	True	6qx35o	https://external-preview.redd.it/CPiX9K-e4oKkANfAld4puRB25btoOXmM4IIFNP-lmhM.jpg?width=320&crop=smart&auto=webp&s=ef988516d3953cf1564df4a4e80fd93063ed0824		11.0	109	propagandaposters	"""Toast by Mayo"", U.S. WWI Recruitment, approx. 1917"	0.99	0	1	5
YippyTheYipster	ld trotsky the organizer of the red army prosecuted by the world bourgeoisie dutch revolutionary socialist workers party	1501673215.0	i.imgur.com	True	6r3ilv	https://external-preview.redd.it/QKZGZHfvaZMdZ1K_7BN1H-GuPqE7XVd-qRE49_ItKFs.png?width=320&crop=smart&auto=webp&s=8a14882f82770300f9bf4c7681f9fcf479cd9ac4		5.0	61	propagandaposters	"""L.D. Trotsky, the organizer of the Red Army, prosecuted by the world bourgeoisie"", Dutch Revolutionary Socialist Workers' Party, February 1937"	0.93	0	1	5
commieflirt	university pennants election	1471063981.0	i.redd.it	True	4xhopn	https://preview.redd.it/m35kvm9xy2fx.jpg?width=320&crop=smart&auto=webp&s=dbf30a59eee54198b6bb3756175fe761a4ae4f21		9.0	85	propagandaposters	"""University Pennants"" 2016 election"	0.87	0	1	5
MiskaMeMeMe	men of valor they fight for you album in comments wwii canada	1502301939.0	imgur.com	True	6snayw	https://external-preview.redd.it/NnMvdpXZUCO_jUu_kVuKisSDNeNtMuaTei34FHmhsmc.jpg?width=320&crop=smart&auto=webp&s=c985382ac2dbbf897eb53cdf09e54131d7f31e84		14.0	373	propagandaposters	Men of Valor - They fight for you. Album in comments (WWII / Canada)	0.96	0	1	5
Calimhero	swiss antiimmigration poster	1374089024.0	souciant.com	True	1ii86h	https://external-preview.redd.it/ghUcwNsHg5nIcN2esV5aQqabEf2qlphNnbC93WjtKVg.png?width=320&crop=smart&auto=webp&s=96fed9dc4c77fed414be074245e3ff8c925e8ebf		9.0	83	propagandaposters	Swiss anti-immigration poster, 2012	0.93	0	1	5
RobertSparrow	the snake god pity the spies the traitors the profiteers the slackers the snakes liberty loan poster from wwi	1388871291.0	i.imgur.com	True	1uez8c	https://external-preview.redd.it/TpJqk8s6dtYZZcmeozJCnavo4PQYPFlkYxZd6PnXwRs.jpg?width=320&crop=smart&auto=webp&s=a405eaa476f10bea6e7181e433e8822ae1b8bfd8		3.0	45	propagandaposters	"""The Snake - God pity the spies, the traitors, the profiteers, the slackers, the snakes..."" Liberty Loan poster from WWI, 1916"	0.93	0	1	5
Windows7Guy100	chinese poster showing tibetans happily welcoming chinese troops into lhasa	1440199052.0	shugdeninfo.com	True	3hwqta	https://external-preview.redd.it/owy_Cn61qRohJ4qts-hbEYbHQHbLGtqlJrnKISlSoUo.jpg?width=320&crop=smart&auto=webp&s=757c2a955983afc68b1954cf55f4f0c1fac0846d		18.0	282	propagandaposters	Chinese propaganda poster showing Tibetans happily welcoming Chinese troops into Lhasa	0.97	0	1	5
TynShouldHaveLived	firmly support the decision of the central committee to deal with the illegal organization of falun gong antifalun gong posterprc designed by cheng guoying	1500694675.0	i.redd.it	True	6oswhm	https://preview.redd.it/i5a15zlvd2bz.jpg?width=320&crop=smart&auto=webp&s=b26822844ec26354b773b00762092608d27b5202		6.0	29	propagandaposters	"""Firmly support the decision of the Central Committee to deal with the illegal organization of 'Falun Gong'"" Anti-Falun Gong poster-PRC, 1999, designed by Cheng Guoying"	0.9	0	1	5
Swazi666	offensive for the basque country by juan antonio salvador carmona spanish civil war poster	1367091710.0	i.imgur.com	True	1d8c6c	https://external-preview.redd.it/d4yAUJhWfErYf9F102FjYPlkJ08SK_4Nxds-D_49LBI.jpg?width=320&crop=smart&auto=webp&s=c13d94ea1a3410dda73cb1bb8c22b23eea86c6d5		1.0	76	propagandaposters	Offensive for the Basque Country by Juan Antonio Salvador Carmona, 1937 [Spanish Civil War, poster]	0.93	0	1	5
Medibee	our most precious jewel	1439917301.0	i.imgur.com	True	3hgu7j	https://external-preview.redd.it/YZG1ACIOFoQ4hsuhOWF0Ow-gPhpXQSwLVBeVbXv8HCY.jpg?width=320&crop=smart&auto=webp&s=d38f2779af0b95dba5ca47eadefda35dd3329f8d		1.0	18	propagandaposters	(1916) Our most precious jewel	0.88	0	1	5
peletiah	we shall trample on the usa iran	1418820036.0	poab.org	True	2pklhs	https://external-preview.redd.it/4YZp91IO3UsRSnaJ-6S9pn-5-7D8HsyyU6oq97p9g0k.jpg?width=320&crop=smart&auto=webp&s=ffb93aa39443a4d422b9550dc159ff83af89acd4		0.0	15	propagandaposters	We shall trample on the USA - Iran 2013	0.8	0	1	5
CharmzOC	justice is no longer blind usa anticorruption	1464382007.0	idroom.ch	True	4lcqpq	https://external-preview.redd.it/OkQ8Py5ZMofxucifuNRdbkcci2qkBAls5LXJLYrYPXI.jpg?width=320&crop=smart&auto=webp&s=6333d77cb960b2c26710799830c35679fda9524c		14.0	439	propagandaposters	"""Justice is No Longer Blind"", USA Anti-Corruption, 2016"	0.96	0	1	5
michaelconfoy	take it from me brother weve still got a big job to do	1412618292.0	i.imgur.com	True	2igvbu	https://external-preview.redd.it/MkDcq0lt5ZbJxKAosh8_fJgYt-EUUzBHkNt28gkOUvU.jpg?width=320&crop=smart&auto=webp&s=550581c9d979109ca433c6211125e29a43b1844f		3.0	32	propagandaposters	"""TAKE IT FROM ME. BROTHER - WE'VE STILL GOT A BIG JOB TO DO!"" 1943."	0.9	0	1	5
bailsafe	chairman mao gives us a happy life prc	1501698235.0	i.redd.it	True	6r66y2	https://preview.redd.it/32k8l598addz.jpg?width=320&crop=smart&auto=webp&s=fb2e5a2c73d8f30d4cf37ed5896f3694a63c722a		11.0	59	propagandaposters	"""Chairman Mao gives us a happy life"", March 1954, PRC"	0.98	0	1	5
RichardMillard	the chinese pest	1417771941.0	getting-it-together.moadoph.gov.au	True	2ocni0	https://external-preview.redd.it/8LuUdv5c97aqnn7GM76CAxKLgOXhrdcIeg-onIIjA-Y.jpg?width=320&crop=smart&auto=webp&s=22709982bb49ae389b79985bcdac4644163cf60f		11.0	104	propagandaposters	The Chinese Pest (1888)	0.98	0	1	5
	donald trump beheading the statue of liberty by bill bramhall	1466566946.0	i.imgur.com	True	4p8paz	https://external-preview.redd.it/P3E9DGRnkwOoinoBkznEnQ3CPtkBO4LOiA8V9d6F8Jk.jpg?width=320&crop=smart&auto=webp&s=d24c5aec50b4b9c3ed8f1c5b8769a3ceffe70361		6.0	34	propagandaposters	Donald Trump beheading the Statue of Liberty (2016) by Bill Bramhall	0.74	0	1	5
germanwalrus	brexit the daily records frontpage today is rather blunt	1466754517.0	imgur.com	True	4plqav	https://external-preview.redd.it/cMDrKaLkOn2dSCAlSZT6KbJjwaI4rcLTau6I9NGjngw.jpg?width=320&crop=smart&auto=webp&s=a8f5244538ab3b3d44e47cf4af64e4be1b2d2889		12.0	44	propagandaposters	(2016 Brexit) The Daily Record's frontpage today is rather blunt	0.85	0	1	5
captainconway	make it dark by otto sanderhewig poster	1367270145.0	i.imgur.com	True	1dd4i2	https://external-preview.redd.it/_mAIrpQKcyKE4qakzhRlqIO3l334Wic985iGb3lJZBA.jpg?width=320&crop=smart&auto=webp&s=48fb44813c36bb6c80f3deb7c5a7a4fd136a503e		3.0	16	propagandaposters	"""Make it Dark"" by Otto Sander-Hewig, 1940 [Poster]"	0.9	0	1	5
alllie	gebet um sieg prayer for victory by willibald krain pacifism wwi	1368199606.0	imgur.com	True	1e2mwm	https://external-preview.redd.it/pz_gEKWkGGrobdZKNNzL9MEiX7NUFxlkulHqrF5oke0.jpg?width=320&crop=smart&auto=webp&s=0f3dd44a63453fef9298ea1af2b23cf048fafdcb		3.0	190	propagandaposters	Gebet um Sieg (Prayer for victory) by Willibald Krain, 1916 [Pacifism, WWI]	0.96	0	1	5
rawveggies	my life for ireland antibritish movie film poster	1370889027.0	i.imgur.com	True	1g26ug	https://external-preview.redd.it/0CWmeW6qOzhqjDQNbFDF0GK_O-7m5OT4EOQTtBCxhiM.jpg?width=320&crop=smart&auto=webp&s=05e901866ca321122ffc8ce55b1c32429b563592		20.0	151	propagandaposters	"""My Life for Ireland"" anti-British movie, 1941 [Film Poster]"	0.96	0	1	5
AirRaidJade	video time for some campaignin american election satire	1471970098.0	youtube.com	True	4z7dcb	https://external-preview.redd.it/Sfi2HIZreIM1iGxenWDkZ3tiEX6K4xwuG19x69boRX4.jpg?width=320&crop=smart&auto=webp&s=1ae284a016d4875ec917cbe30f9d036410d2b8e5		1.0	26	propagandaposters	"[VIDEO] ""Time For Some Campaignin'"" - American election satire, 2008"	0.89	0	1	5
Mayhem5100	pro eugenics poster mentally ill negro english years in an institution costing reichsmarks nazi germany	1464547619.0	i.imgur.com	True	4llnl8	https://external-preview.redd.it/TUDduyarH5-fe0VRKNxdPvHsCa_3T4GlOzA1z-wluCA.jpg?width=320&crop=smart&auto=webp&s=6fb3c15dd311fbe2a7aa5adbf83c9f149ac41f15		10.0	51	propagandaposters	Pro eugenics poster - “Mentally ill Negro (English) 16 years in an institution costing 35,000 Reichsmarks '' . Nazi germany , 1939 .	0.88	0	1	5
KID_LIFE_CRISIS	books are weapons in the war of ideas depicts nazi bookburning fdr quote american	1424299521.0	i.imgur.com	True	2wd4ue	https://external-preview.redd.it/XdbIuYMd4j8VguxaV8ZxjA3VG3gpCPOpKLmoqiGj-wg.jpg?width=320&crop=smart&auto=webp&s=bdaf70523948ca077729aaeacf95c0ae0e7f7371		2.0	89	propagandaposters	"""BOOKS ARE WEAPONS IN THE WAR OF IDEAS"" (depicts Nazi book-burning, FDR quote) American, 1942"	0.99	0	1	5
GreatDario	boumboum ii germany france s	1495087034.0	i.redd.it	True	6budbt	https://preview.redd.it/fn4zf64e77yy.jpg?width=320&crop=smart&auto=webp&s=73c4ab18ab98f314ddc525b2c2d0dcb54dcd3c69		2.0	23	propagandaposters	"""Boum-Boum II (Germany)"" France, 1910s."	0.94	0	1	5
TheMLGSpud	save the east german national peoples party	1484738333.0	i.redd.it	True	5oot6b	https://preview.redd.it/o4fabbzdfgay.jpg?width=320&crop=smart&auto=webp&s=5c00c1ab09e9300cf2b24f1bacfe65b2b8317285		13.0	62	propagandaposters	"""Save the East"", German National Peoples Party, 1920"	0.94	0	1	5
rpilek	save your fruit pits and send them to school with your children or bring them to the next collection site	1417820448.0	i.imgur.com	True	2oeqf4	https://external-preview.redd.it/rgFJbOrrVEPCWE_NFr8r0riaCfodMV7iR2aib_sqffo.jpg?width=320&crop=smart&auto=webp&s=6b507a843c017f1fc6820f02fda4f940c29cf384		7.0	26	propagandaposters	"""Save your fruit pits and send them to school with your children or bring them to the next collection site."" 1916."	0.86	0	1	5
TynShouldHaveLived	fatherland front poster advertising lottery for dolfus monumentaustria by karl tontur	1498268220.0	i.redd.it	True	6j5ih3	https://preview.redd.it/t1960qxqyh5z.jpg?width=216&crop=smart&auto=webp&s=78a12361ec993136354ec5f68078064dda1d9fd3		0.0	78	propagandaposters	Fatherland Front poster advertising lottery for Dolfus Monument-Austria, 1935, by Karl Tontur	0.95	0	1	5
Dusepo	how to fight wars	1480251699.0	i.redd.it	True	5f574l	https://preview.redd.it/adnh1ctpu50y.jpg?width=320&crop=smart&auto=webp&s=af1b6fec9fd101eec069d13a2a6166ab08a6a6b8		7.0	125	propagandaposters	"""How to fight wars..."" [2009]"	0.92	0	1	5
ConorPF	modern fictional all hail the one true five from an episode of community	1411338344.0	pbs.twimg.com	True	2h2lvl	https://external-preview.redd.it/eLj7MBefP5M-zdFWKZgPoxx1gn3uxVgVFrdsTVaJTkw.jpg?width=320&crop=smart&auto=webp&s=71050f707d211a421d0e0d5d30472ced152eec9e		2.0	5	propagandaposters	"[Modern] [Fictional] ""All Hail the One True Five"" from an episode of Community"	0.64	0	1	5
the_seed	you and the atomic bomb preparedness pamphlet from the s	1445231014.0	m.imgur.com	True	3pbfn1	https://external-preview.redd.it/VcI0WuL2rdpf_Zg_z6KhLWz5J7mOtzLEmIRJ2K5fz4s.jpg?width=320&crop=smart&auto=webp&s=f01bec7c6d01fadc275b5ab49b294644f3662da0		2.0	11	propagandaposters	"""You and the Atomic Bomb"" preparedness pamphlet from the 50's (x-post /r/thewaywewere)"	0.93	0	1	5
Crowe410	if god doesnt matter to him do you antiatheist billboard by the creationist group answers in genesis usa late s	1488763901.0	i.imgur.com	True	5xqgs5	https://external-preview.redd.it/ymRlBhNVdLMMIGCn-l1frTbPQkl71kdXoRFFUJ85pgo.jpg?width=320&crop=smart&auto=webp&s=cc1ff1144eacf3d36315f83d3626ff92ff578bdd		172.0	1337	propagandaposters	"""If God doesn't matter to him, do you"" Anti-Atheist billboard by the creationist group Answers in Genesis, USA, late 2000s"	0.93	0	1	5
